id,name,register_date,followed_by,followers_count,link
1646945251305873408,James Wynn,Fri Apr 14 18:35:29 +0000 2023,"serg_xyz, 0xRaghav, OmniscientAsian, 0xWenMoon, 0xminion, janehk, YeouJie, benlakoff, Shaughnessy119, lmrankhan, j0hnwang, krybharat, AjeetK, sjdedic, jonathankingvc, jennyqcheng, 0xdetweiler, 0xChanglu, pokeapallascat, mattyryze, zacxbt, AustinBarack, roybitsir",23,https://x.com/i/user/1646945251305873408
1141915100284182528,Cited,Fri Jun 21 03:45:50 +0000 2019,"serg_xyz, stutireal, Darrenlautf, 0xWenMoon, 0xminion, YeouJie, bridge__harris, robbiepetersen_, j0hnwang, krybharat, cooper_kunz, CryptoSources, sjdedic, 0xMaki, yekiM_o, caitlinxyz, jnwng, GrantStenger, kapursanat",19,https://x.com/i/user/1141915100284182528
1697597266515619840,Bullpen,Fri Sep 01 13:09:48 +0000 2023,"serg_xyz, 0xRaghav, Darrenlautf, 0xminion, BigBrainKasey, Shaughnessy119, j0hnwang, krybharat, jonathankingvc, Sh_ivam, 0xMaki, 0xdetweiler, samoyedali, alexgedevani, mattyryze, zacxbt, AustinBarack, roybitsir, GrantStenger, kapursanat",20,https://x.com/i/user/1697597266515619840
2451580038,Jack Longarzo,Fri Apr 18 16:00:24 +0000 2014,"serg_xyz, QwQiao, 0xminion, rishisthinking, Daryllautk, masonnystrom, Mikey0x_, pet3rpan_, bridge__harris, eclecticcapital, lmrankhan, notnotstorm, j0hnwang, 0xMaki, mattyryze, delitzer, GrantStenger, tomhschmidt, kapursanat",19,https://x.com/i/user/2451580038
837884551984730113,David Ticzon | Sui💧Chief Degen,Sat Mar 04 04:36:59 +0000 2017,"serg_xyz, QwQiao, KyleSamani, stutireal, Darrenlautf, 0xminion, janehk, reganbozman, wkhosrowshahi1, BigBrainKasey, caseykcaruso, bridge__harris, j0hnwang, Sh_ivam, 0xMaki, mattyryze, zacxbt, AustinBarack, GrantStenger, kapursanat",20,https://x.com/i/user/837884551984730113
1237277237671387137,Saneel,Tue Mar 10 07:21:01 +0000 2020,"serg_xyz, KyleSamani, OmniscientAsian, 0xminion, janehk, Daryllautk, 0xRainandCoffee, sandraaleow, tkstanczak, geenty, notnotstorm, j0hnwang, 0xMaki, sjrosenblum, 0xChanglu, gakonst, zacxbt, roybitsir, TaikiMaeda2, GrantStenger, tomhschmidt, kapursanat",22,https://x.com/i/user/1237277237671387137
1336934358649737222,Jack Chong,Thu Dec 10 07:22:53 +0000 2020,"serg_xyz, stutireal, Darrenlautf, 0xminion, janehk, 0xRainandCoffee, wkhosrowshahi1, andyisnotandy, Mikey0x_, OuroborosCap8, robbiepetersen_, tkstanczak, j0hnwang, ceterispar1bus, samoyedali, thetinaverse, MariaShen, mattyryze, GrantStenger",19,https://x.com/i/user/1336934358649737222
967515043918204929,Mathijs,Sat Feb 24 21:42:16 +0000 2018,"serg_xyz, 0xRaghav, grisacerne, Darrenlautf, 0xminion, kidponga, janehk, rishisthinking, 0xRainandCoffee, sandraaleow, bridge__harris, Louissongyz, j0hnwang, ncerovac, sjdedic, alexgedevani, roybitsir, TaikiMaeda2, kapursanat",19,https://x.com/i/user/967515043918204929
2423897114,Jiani Chen,Wed Apr 02 14:29:37 +0000 2014,"serg_xyz, KyleSamani, stutireal, ishanee_, rishisthinking, 0xRainandCoffee, andyisnotandy, benlakoff, pet3rpan_, bridge__harris, Louissongyz, Shaughnessy119, firstc0in, jonathankingvc, 0xMaki, alexgedevani, jnwng, mattyryze, kapursanat",19,https://x.com/i/user/2423897114
1141179834,Hsin-Ju | Hack VC ⏩ Permissionless,Sat Feb 02 01:36:22 +0000 2013,"serg_xyz, 0xRaghav, QwQiao, OmniscientAsian, Darrenlautf, 0xminion, janehk, Daryllautk, benlakoff, pet3rpan_, panekkkk, tkstanczak, lmrankhan, j0hnwang, ncerovac, 0xMaki, MariaShen, roybitsir, delitzer, tomhschmidt",20,https://x.com/i/user/1141179834
1324946096221642754,gen,Sat Nov 07 05:25:48 +0000 2020,"serg_xyz, KyleSamani, OmniscientAsian, Darrenlautf, 0xminion, ishanee_, Daryllautk, 0xRainandCoffee, sandraaleow, YeouJie, Mikey0x_, pet3rpan_, OuroborosCap8, Shaughnessy119, j0hnwang, sjdedic, 0xMaki, alexgedevani, MariaShen, mattyryze, kapursanat",21,https://x.com/i/user/1324946096221642754
1207822149248962561,enzo,Fri Dec 20 00:37:03 +0000 2019,"serg_xyz, grisacerne, Darrenlautf, 0xminion, rishisthinking, Daryllautk, 0xRainandCoffee, bridge__harris, j0hnwang, sjdedic, caitlinxyz, Solofunk30, MariaShen, mattyryze, AustinBarack, roybitsir, gregohr12, TaikiMaeda2, GrantStenger, tomhschmidt, kapursanat",21,https://x.com/i/user/1207822149248962561
864649212394438656,jae,Wed May 17 01:10:11 +0000 2017,"serg_xyz, QwQiao, 0xminion, janehk, Daryllautk, sandraaleow, masonnystrom, andyisnotandy, benlakoff, lmrankhan, j0hnwang, krybharat, CryptoSources, sjdedic, 0xMaki, 0xChanglu, mattyryze, AustinBarack, TaikiMaeda2, GrantStenger",20,https://x.com/i/user/864649212394438656
3170157773,Andrew Reed,Wed Apr 15 14:05:08 +0000 2015,"serg_xyz, KyleSamani, stutireal, ishanee_, janehk, masonnystrom, bridge__harris, panekkkk, amanda0x, geenty, j0hnwang, HoolieG, sjrosenblum, caitlinxyz, gakonst, MariaShen, roybitsir, GrantStenger, tomhschmidt",19,https://x.com/i/user/3170157773
991062733675225088,Ashwin,Mon Apr 30 21:12:23 +0000 2018,"serg_xyz, QwQiao, KyleSamani, Darrenlautf, 0xminion, janehk, Daryllautk, sandraaleow, masonnystrom, bridge__harris, panekkkk, firstc0in, lmrankhan, j0hnwang, 0xMaki, MariaShen, zacxbt, AustinBarack, roybitsir, delitzer, tomhschmidt",21,https://x.com/i/user/991062733675225088
259780392,TheBabylonians,Wed Mar 02 15:48:04 +0000 2011,"serg_xyz, 0xRaghav, 0xWenMoon, kidponga, Daryllautk, sandraaleow, YeouJie, andyisnotandy, robbiepetersen_, j0hnwang, sjdedic, jennyqcheng, 0xMaki, samoyedali, mattyryze, zacxbt, AustinBarack, roybitsir, TaikiMaeda2",19,https://x.com/i/user/259780392
1269561030272643076,⁵⁄₉,Sun Jun 07 09:25:20 +0000 2020,"serg_xyz, 0xminion, Daryllautk, 0xRainandCoffee, wkhosrowshahi1, andyisnotandy, benlakoff, bridge__harris, tkstanczak, firstc0in, notnotstorm, j0hnwang, 0xMaki, yekiM_o, caitlinxyz, gakonst, MariaShen, mattyryze, delitzer, GrantStenger, tomhschmidt, kapursanat",22,https://x.com/i/user/1269561030272643076
741094860,Sam Rosenblum,Mon Aug 06 17:47:26 +0000 2012,"serg_xyz, QwQiao, KyleSamani, NTmoney, stutireal, Darrenlautf, 0xminion, ishanee_, janehk, Daryllautk, masonnystrom, Louissongyz, j0hnwang, sjdedic, jonathankingvc, 0xMaki, HoolieG, caitlinxyz, roybitsir, GrantStenger, tomhschmidt",21,https://x.com/i/user/741094860
1024699964071522305,MoonPay 🟣,Wed Aug 01 16:54:44 +0000 2018,"serg_xyz, NTmoney, stutireal, janehk, reganbozman, wkhosrowshahi1, andyisnotandy, lmrankhan, j0hnwang, krybharat, ncerovac, jonathankingvc, Sh_ivam, 0xChanglu, NaytheForceBwU, jnwng, mattyryze, zacxbt, 0xbilly",19,https://x.com/i/user/1024699964071522305
956303925438746629,Noah,Wed Jan 24 23:13:17 +0000 2018,"serg_xyz, luffistotle, OmniscientAsian, 0xWenMoon, 0xminion, kidponga, rishisthinking, wkhosrowshahi1, YeouJie, Mikey0x_, robbiepetersen_, amanda0x, Sh_ivam, ceterispar1bus, caitlinxyz, alexgedevani, mattyryze, AustinBarack, TaikiMaeda2, delitzer",20,https://x.com/i/user/956303925438746629
337327458,Omar,Sun Jul 17 21:09:26 +0000 2011,"serg_xyz, 0xRaghav, stutireal, Darrenlautf, wkhosrowshahi1, 0xKofi, robbiepetersen_, j0hnwang, Sh_ivam, ceterispar1bus, caitlinxyz, Solofunk30, alexgedevani, mattyryze, AustinBarack, gregohr12, TaikiMaeda2, tomhschmidt, kapursanat",19,https://x.com/i/user/337327458
481756924,shikhai,Fri Feb 03 04:23:22 +0000 2012,"serg_xyz, 0xRaghav, Darrenlautf, 0xminion, ishanee_, rishisthinking, 0xRainandCoffee, sandraaleow, YeouJie, pet3rpan_, Shaughnessy119, j0hnwang, sjdedic, 0xMaki, RyanKSterling, alexgedevani, pokeapallascat, mattyryze, AustinBarack",19,https://x.com/i/user/481756924
1492187153605877761,Matthew Beck,Fri Feb 11 17:24:06 +0000 2022,"serg_xyz, QwQiao, KyleSamani, Darrenlautf, kidponga, janehk, Daryllautk, wkhosrowshahi1, andyisnotandy, Shaughnessy119, amanda0x, j0hnwang, sjdedic, jonathankingvc, NaytheForceBwU, jnwng, mattyryze, AustinBarack, GrantStenger, kapursanat",20,https://x.com/i/user/1492187153605877761
426445275,HB,Fri Dec 02 07:34:31 +0000 2011,"serg_xyz, KyleSamani, Darrenlautf, 0xminion, janehk, Daryllautk, 0xRainandCoffee, sandraaleow, andyisnotandy, Mikey0x_, panekkkk, Shaughnessy119, geenty, lmrankhan, j0hnwang, 0xMaki, ceterispar1bus, alexgedevani, AustinBarack, TaikiMaeda2",20,https://x.com/i/user/426445275
1422608862868172803,ted (on farcaster),Tue Aug 03 17:22:42 +0000 2021,"serg_xyz, NTmoney, janehk, Daryllautk, benlakoff, eclecticcapital, amanda0x, geenty, lmrankhan, j0hnwang, jonathankingvc, HoolieG, sjrosenblum, yekiM_o, gakonst, alexgedevani, NaytheForceBwU, jnwng, MariaShen, GrantStenger",20,https://x.com/i/user/1422608862868172803
15894997,Curtis Spencer,Mon Aug 18 18:59:19 +0000 2008,"serg_xyz, KyleSamani, 0xWenMoon, 0xminion, kidponga, janehk, Daryllautk, pet3rpan_, Shaughnessy119, notnotstorm, j0hnwang, sjdedic, jonathankingvc, 0xMaki, caitlinxyz, gakonst, MariaShen, mattyryze, roybitsir, delitzer, GrantStenger, tomhschmidt",22,https://x.com/i/user/15894997
1285527355163721730,ish,Tue Jul 21 10:49:58 +0000 2020,"serg_xyz, grisacerne, OmniscientAsian, stutireal, 0xminion, kidponga, YeouJie, masonnystrom, andyisnotandy, Louissongyz, eclecticcapital, lmrankhan, jennyqcheng, Sh_ivam, 0xMaki, 0xChanglu, mattyryze, delitzer, kapursanat",19,https://x.com/i/user/1285527355163721730
591975273,Doug,Sun May 27 15:04:43 +0000 2012,"serg_xyz, KyleSamani, Darrenlautf, 0xminion, janehk, rishisthinking, Daryllautk, 0xRainandCoffee, caseykcaruso, Louissongyz, OuroborosCap8, notnotstorm, j0hnwang, sjdedic, 0xMaki, samoyedali, 0xChanglu, caitlinxyz, gakonst, alexgedevani, roybitsir, GrantStenger",22,https://x.com/i/user/591975273
16947213,Camilla McFarland,Fri Oct 24 10:41:35 +0000 2008,"serg_xyz, NTmoney, stutireal, janehk, masonnystrom, benlakoff, eclecticcapital, panekkkk, amanda0x, ncerovac, 0xMaki, 0xChanglu, MariaShen, mattyryze, zacxbt, AustinBarack, delitzer, tomhschmidt, 0xbilly",19,https://x.com/i/user/16947213
619916463,Paul Razvan Berg,Wed Jun 27 09:27:15 +0000 2012,"serg_xyz, QwQiao, KyleSamani, NTmoney, 0xminion, janehk, pet3rpan_, Louissongyz, panekkkk, tkstanczak, firstc0in, j0hnwang, ncerovac, 0xMaki, gakonst, MariaShen, zacxbt, AustinBarack, delitzer, tomhschmidt, 0xbilly",21,https://x.com/i/user/619916463
1084668943405436928,CHAINFLIP LABS,Mon Jan 14 04:30:03 +0000 2019,"serg_xyz, Darrenlautf, 0xminion, kidponga, janehk, 0xRainandCoffee, sandraaleow, wkhosrowshahi1, panekkkk, Shaughnessy119, firstc0in, j0hnwang, sjdedic, jennyqcheng, 0xMaki, samoyedali, mattyryze, AustinBarack, 0xbilly",19,https://x.com/i/user/1084668943405436928
1366753588047978500,ultra sound money 🦇🔊,Tue Mar 02 14:14:11 +0000 2021,"serg_xyz, NTmoney, 0xminion, kidponga, benlakoff, notnotstorm, j0hnwang, ncerovac, jonathankingvc, Sh_ivam, 0xMaki, yekiM_o, samoyedali, alexgedevani, MariaShen, mattyryze, AustinBarack, tomhschmidt, 0xbilly",19,https://x.com/i/user/1366753588047978500
1501997405755088900,wale.moca 🐳,Thu Mar 10 19:04:27 +0000 2022,"serg_xyz, 0xWenMoon, sandraaleow, YeouJie, masonnystrom, andyisnotandy, Mikey0x_, AliceL991, krybharat, sjdedic, 0xMaki, RyanKSterling, 0xChanglu, Solofunk30, alexgedevani, MariaShen, mattyryze, zacxbt, AustinBarack, gregohr12",20,https://x.com/i/user/1501997405755088900
1384711969912102912,Garga.eth (Greg Solano),Wed Apr 21 03:34:05 +0000 2021,"serg_xyz, NTmoney, Darrenlautf, andyisnotandy, pet3rpan_, cosmo_jiang, AliceL991, tkstanczak, lmrankhan, krybharat, ncerovac, jonathankingvc, jennyqcheng, Sh_ivam, 0xMaki, HoolieG, yekiM_o, MariaShen, mattyryze, tomhschmidt",20,https://x.com/i/user/1384711969912102912
357312062,Bitcoin,Thu Aug 18 05:06:08 +0000 2011,"serg_xyz, KyleSamani, OmniscientAsian, 0xWenMoon, janehk, wkhosrowshahi1, andyisnotandy, benlakoff, Yedidbotton, lmrankhan, j0hnwang, CryptoSources, sjrosenblum, jnwng, MariaShen, zacxbt, AustinBarack, roybitsir, 0xbilly",19,https://x.com/i/user/357312062
763026986600194052,Omer Goldberg,Tue Aug 09 14:59:44 +0000 2016,"0xRaghav, KyleSamani, 0xminion, janehk, rishisthinking, panekkkk, Shaughnessy119, firstc0in, lmrankhan, j0hnwang, jonathankingvc, 0xMaki, sjrosenblum, MariaShen, mattyryze, zacxbt, roybitsir, delitzer, GrantStenger",19,https://x.com/i/user/763026986600194052
1838288550569349120,TBPN,Mon Sep 23 18:45:29 +0000 2024,"0xRaghav, KyleSamani, stutireal, ishanee_, janehk, Daryllautk, bridge__harris, lmrankhan, j0hnwang, jonathankingvc, 0xMaki, HoolieG, sjrosenblum, yekiM_o, caitlinxyz, alexgedevani, NaytheForceBwU, mattyryze, tomhschmidt, kapursanat",20,https://x.com/i/user/1838288550569349120
1925414006053117952,Loud!,Thu May 22 04:51:10 +0000 2025,"0xRaghav, OmniscientAsian, 0xWenMoon, 0xminion, sandraaleow, robbiepetersen_, j0hnwang, CryptoSources, sjdedic, jonathankingvc, 0xdetweiler, 0xChanglu, Solofunk30, pokeapallascat, mattyryze, zacxbt, roybitsir, gregohr12, 0xbilly",19,https://x.com/i/user/1925414006053117952
1571195311611150337,Dirichlet,Sat Sep 17 17:52:22 +0000 2022,"0xRaghav, QwQiao, KyleSamani, stutireal, janehk, rishisthinking, Daryllautk, wkhosrowshahi1, BigBrainKasey, eclecticcapital, robbiepetersen_, amanda0x, j0hnwang, krybharat, jonathankingvc, HoolieG, Solofunk30, jnwng, gregohr12, TaikiMaeda2",20,https://x.com/i/user/1571195311611150337
1661523610111193088,xAI,Thu May 25 00:06:30 +0000 2023,"0xRaghav, KyleSamani, OmniscientAsian, 0xminion, janehk, rishisthinking, benlakoff, Shaughnessy119, lmrankhan, j0hnwang, op7418, krybharat, ncerovac, jonathankingvc, Sh_ivam, NaytheForceBwU, thetinaverse, mattyryze, GrantStenger, 0xbilly",20,https://x.com/i/user/1661523610111193088
1167798821050433537,Theo Diamandis,Sat Aug 31 13:58:48 +0000 2019,"0xRaghav, KyleSamani, Darrenlautf, 0xminion, 0xRainandCoffee, andyisnotandy, bridge__harris, eclecticcapital, notnotstorm, j0hnwang, _weidai, jennyqcheng, gakonst, NaytheForceBwU, MariaShen, mattyryze, GrantStenger, tomhschmidt, kapursanat",19,https://x.com/i/user/1167798821050433537
1851730950566350850,griffain,Wed Oct 30 21:00:51 +0000 2024,"0xRaghav, OmniscientAsian, 0xWenMoon, 0xminion, 0xRainandCoffee, sandraaleow, robbiepetersen_, Shaughnessy119, j0hnwang, krybharat, CryptoSources, jonathankingvc, jennyqcheng, Sh_ivam, 0xMaki, yekiM_o, mattyryze, AustinBarack, roybitsir, tomhschmidt",20,https://x.com/i/user/1851730950566350850
1654900077453012992,Holoworld AI,Sat May 06 17:25:31 +0000 2023,"0xRaghav, 0xminion, AliceL991, Shaughnessy119, j0hnwang, krybharat, CryptoSources, jonathankingvc, jennyqcheng, Sh_ivam, RyanKSterling, 0xdetweiler, samoyedali, 0xChanglu, Solofunk30, NaytheForceBwU, jnwng, mattyryze, zacxbt, roybitsir",20,https://x.com/i/user/1654900077453012992
1448638253070966789,rAAVE 👻,Thu Oct 14 13:14:14 +0000 2021,"0xRaghav, OmniscientAsian, Darrenlautf, 0xminion, reganbozman, 0xRainandCoffee, andyisnotandy, benlakoff, panekkkk, AliceL991, notnotstorm, j0hnwang, ncerovac, CryptoSources, 0xMaki, yekiM_o, Solofunk30, alexgedevani, MariaShen, mattyryze, kapursanat",21,https://x.com/i/user/1448638253070966789
1484922694651060235,alexander,Sat Jan 22 16:17:05 +0000 2022,"0xRaghav, Darrenlautf, 0xWenMoon, Daryllautk, sandraaleow, wkhosrowshahi1, masonnystrom, andyisnotandy, pet3rpan_, cosmo_jiang, OuroborosCap8, amanda0x, notnotstorm, jonathankingvc, 0xMaki, HoolieG, yekiM_o, Solofunk30, mattyryze, AustinBarack",20,https://x.com/i/user/1484922694651060235
1709251477288742916,Anza,Tue Oct 03 16:58:29 +0000 2023,"0xRaghav, KyleSamani, 0xminion, janehk, Daryllautk, 0xRainandCoffee, eclecticcapital, tkstanczak, Sh_ivam, 0xMaki, ceterispar1bus, Solofunk30, NaytheForceBwU, jnwng, MariaShen, mattyryze, AustinBarack, GrantStenger, tomhschmidt",19,https://x.com/i/user/1709251477288742916
1547270812566110210,Skip,Wed Jul 13 17:27:08 +0000 2022,"0xRaghav, 0xminion, kidponga, 0xRainandCoffee, bridge__harris, eclecticcapital, robbiepetersen_, sjdedic, 0xMaki, sjrosenblum, yekiM_o, ceterispar1bus, samoyedali, gakonst, Solofunk30, mattyryze, zacxbt, AustinBarack, roybitsir, GrantStenger, kapursanat",21,https://x.com/i/user/1547270812566110210
388024471,terence,Mon Oct 10 02:01:34 +0000 2011,"0xRaghav, KyleSamani, 0xWenMoon, janehk, Daryllautk, 0xRainandCoffee, pet3rpan_, panekkkk, tkstanczak, lmrankhan, notnotstorm, j0hnwang, ncerovac, 0xMaki, gakonst, MariaShen, AustinBarack, roybitsir, kapursanat, 0xbilly",20,https://x.com/i/user/388024471
1655810110118326272,Sorella Labs,Tue May 09 05:41:28 +0000 2023,"0xRaghav, OmniscientAsian, 0xminion, kidponga, Daryllautk, andyisnotandy, benlakoff, Mikey0x_, notnotstorm, Sh_ivam, 0xMaki, yekiM_o, ceterispar1bus, samoyedali, Solofunk30, AustinBarack, roybitsir, delitzer, GrantStenger",19,https://x.com/i/user/1655810110118326272
1551986476442800128,Alex Nezlobin,Tue Jul 26 17:43:29 +0000 2022,"0xRaghav, 0xminion, ishanee_, 0xRainandCoffee, Mikey0x_, bridge__harris, Louissongyz, robbiepetersen_, tkstanczak, firstc0in, lmrankhan, notnotstorm, j0hnwang, 0xMaki, ceterispar1bus, samoyedali, gakonst, roybitsir, delitzer, GrantStenger, kapursanat",21,https://x.com/i/user/1551986476442800128
1342923842675740672,zerokn0wledge 🪬✨,Sat Dec 26 20:02:57 +0000 2020,"0xRaghav, Darrenlautf, 0xWenMoon, ishanee_, 0xRainandCoffee, sandraaleow, andyisnotandy, Louissongyz, panekkkk, Shaughnessy119, krybharat, Sh_ivam, 0xdetweiler, Solofunk30, MariaShen, mattyryze, zacxbt, AustinBarack, GrantStenger",19,https://x.com/i/user/1342923842675740672
934061151008251904,Fabric Ventures,Fri Nov 24 14:08:27 +0000 2017,"0xRaghav, luffistotle, 0xWenMoon, 0xminion, kidponga, janehk, reganbozman, wkhosrowshahi1, Louissongyz, eclecticcapital, panekkkk, robbiepetersen_, 0xdetweiler, samoyedali, alexgedevani, MariaShen, zacxbt, roybitsir, 0xbilly",19,https://x.com/i/user/934061151008251904
1484054404638871555,Louis,Thu Jan 20 06:45:26 +0000 2022,"0xRaghav, QwQiao, OmniscientAsian, stutireal, 0xminion, kidponga, ishanee_, 0xRainandCoffee, YeouJie, masonnystrom, andyisnotandy, Mikey0x_, bridge__harris, firstc0in, jennyqcheng, samoyedali, 0xChanglu, mattyryze, roybitsir, kapursanat",20,https://x.com/i/user/1484054404638871555
1438782829287116802,Across,Fri Sep 17 08:32:23 +0000 2021,"0xRaghav, 0xminion, kidponga, reganbozman, 0xRainandCoffee, bridge__harris, robbiepetersen_, tkstanczak, j0hnwang, CryptoSources, sjdedic, jennyqcheng, Sh_ivam, 0xMaki, ceterispar1bus, Solofunk30, mattyryze, AustinBarack, GrantStenger, tomhschmidt",20,https://x.com/i/user/1438782829287116802
1678552600722182145,NEBRA,Mon Jul 10 23:52:01 +0000 2023,"0xRaghav, 0xminion, janehk, rishisthinking, andyisnotandy, benlakoff, caseykcaruso, bridge__harris, lmrankhan, ncerovac, daedalus_angels, Sh_ivam, 0xMaki, yekiM_o, 0xChanglu, MariaShen, mattyryze, delitzer, kapursanat",19,https://x.com/i/user/1678552600722182145
1516175966028107780,Giza,Mon Apr 18 22:05:22 +0000 2022,"0xRaghav, KyleSamani, 0xminion, janehk, rishisthinking, BigBrainKasey, caseykcaruso, Louissongyz, AliceL991, robbiepetersen_, jonathankingvc, Sh_ivam, samoyedali, mattyryze, zacxbt, AustinBarack, roybitsir, GrantStenger, kapursanat",19,https://x.com/i/user/1516175966028107780
95420970,bartek.eth,Tue Dec 08 13:33:45 +0000 2009,"0xRaghav, OmniscientAsian, 0xminion, Daryllautk, 0xRainandCoffee, andyisnotandy, Louissongyz, tkstanczak, notnotstorm, j0hnwang, cooper_kunz, jonathankingvc, 0xMaki, ceterispar1bus, samoyedali, gakonst, alexgedevani, mattyryze, gregohr12, GrantStenger",20,https://x.com/i/user/95420970
1067470728486895616,LambdaClass,Tue Nov 27 17:30:29 +0000 2018,"0xRaghav, KyleSamani, 0xminion, rishisthinking, 0xRainandCoffee, andyisnotandy, BigBrainKasey, bridge__harris, Louissongyz, AliceL991, tkstanczak, firstc0in, Sh_ivam, 0xMaki, samoyedali, 0xChanglu, gakonst, pokeapallascat, mattyryze, roybitsir",20,https://x.com/i/user/1067470728486895616
1463071986515599362,Starknet 🐺🐱,Tue Nov 23 09:09:09 +0000 2021,"0xRaghav, KyleSamani, OmniscientAsian, 0xminion, andyisnotandy, tkstanczak, lmrankhan, j0hnwang, krybharat, sjdedic, Sh_ivam, 0xdetweiler, ceterispar1bus, 0xChanglu, gakonst, alexgedevani, mattyryze, zacxbt, GrantStenger, 0xbilly",20,https://x.com/i/user/1463071986515599362
900487236315078657,The Render Network,Wed Aug 23 22:37:42 +0000 2017,"0xRaghav, KyleSamani, 0xminion, kidponga, SimaoCCruz, eclecticcapital, cosmo_jiang, Shaughnessy119, lmrankhan, j0hnwang, krybharat, jonathankingvc, Sh_ivam, HoolieG, 0xChanglu, Solofunk30, alexgedevani, jnwng, mattyryze, AustinBarack",20,https://x.com/i/user/900487236315078657
394549103,Naruto11.eth,Thu Oct 20 07:48:43 +0000 2011,"0xRaghav, KyleSamani, 0xWenMoon, rishisthinking, sandraaleow, bridge__harris, notnotstorm, j0hnwang, ncerovac, sjdedic, 0xMaki, samoyedali, gakonst, Solofunk30, pokeapallascat, jnwng, MariaShen, mattyryze, GrantStenger",19,https://x.com/i/user/394549103
47712719,Kunal G,Tue Jun 16 19:08:34 +0000 2009,"0xRaghav, QwQiao, KyleSamani, grisacerne, 0xminion, kidponga, rishisthinking, Daryllautk, sandraaleow, masonnystrom, OuroborosCap8, panekkkk, jonathankingvc, Sh_ivam, Solofunk30, alexgedevani, NaytheForceBwU, mattyryze, AustinBarack",19,https://x.com/i/user/47712719
1004162476273893377,Figment,Wed Jun 06 00:46:05 +0000 2018,"0xRaghav, grisacerne, OmniscientAsian, Darrenlautf, 0xminion, janehk, 0xRainandCoffee, wkhosrowshahi1, andyisnotandy, BigBrainKasey, geenty, Sh_ivam, 0xMaki, Solofunk30, NaytheForceBwU, MariaShen, mattyryze, AustinBarack, roybitsir, kapursanat",20,https://x.com/i/user/1004162476273893377
1384607494442344456,Penumbra 🌘,Tue Apr 20 20:39:21 +0000 2021,"0xRaghav, OmniscientAsian, 0xminion, janehk, rishisthinking, 0xRainandCoffee, andyisnotandy, eclecticcapital, robbiepetersen_, j0hnwang, cooper_kunz, 0xMaki, yekiM_o, ceterispar1bus, gakonst, alexgedevani, mattyryze, roybitsir, GrantStenger, tomhschmidt, kapursanat",21,https://x.com/i/user/1384607494442344456
1441886102906806277,Saga ⛋,Sat Sep 25 22:03:52 +0000 2021,"0xRaghav, 0xminion, 0xRainandCoffee, BigBrainKasey, eclecticcapital, AliceL991, j0hnwang, krybharat, jennyqcheng, Sh_ivam, 0xMaki, yekiM_o, samoyedali, NaytheForceBwU, pokeapallascat, mattyryze, zacxbt, AustinBarack, roybitsir",19,https://x.com/i/user/1441886102906806277
979462167559892993,Odysseus | phylax.systems,Thu Mar 29 20:55:53 +0000 2018,"0xRaghav, KyleSamani, stutireal, 0xminion, Daryllautk, 0xRainandCoffee, wkhosrowshahi1, benlakoff, robbiepetersen_, tkstanczak, notnotstorm, j0hnwang, _weidai, ncerovac, 0xMaki, gakonst, delitzer, kapursanat, 0xbilly",19,https://x.com/i/user/979462167559892993
948821285257146368,josh lee,Thu Jan 04 07:39:57 +0000 2018,"0xRaghav, KyleSamani, NTmoney, 0xminion, janehk, Daryllautk, j0hnwang, jonathankingvc, Sh_ivam, 0xMaki, yekiM_o, ceterispar1bus, samoyedali, alexgedevani, MariaShen, mattyryze, roybitsir, delitzer, GrantStenger",19,https://x.com/i/user/948821285257146368
1766051901823655936,Nachi,Fri Mar 08 10:44:43 +0000 2024,"QwQiao, OmniscientAsian, Darrenlautf, 0xWenMoon, 0xminion, sandraaleow, YeouJie, Louissongyz, Shaughnessy119, lmrankhan, j0hnwang, krybharat, ceterispar1bus, mattyryze, zacxbt, AustinBarack, gregohr12, TaikiMaeda2, 0xbilly",19,https://x.com/i/user/1766051901823655936
101354595,Shaan Puri,Sun Jan 03 00:47:50 +0000 2010,"QwQiao, Darrenlautf, janehk, andyisnotandy, benlakoff, amanda0x, j0hnwang, krybharat, 0xMaki, HoolieG, sjrosenblum, samoyedali, 0xChanglu, alexgedevani, pokeapallascat, jnwng, MariaShen, mattyryze, GrantStenger, 0xbilly",20,https://x.com/i/user/101354595
1381965565615468544,EV3 Sal,Tue Apr 13 13:40:49 +0000 2021,"QwQiao, KyleSamani, grisacerne, kidponga, ishanee_, janehk, rishisthinking, reganbozman, eclecticcapital, robbiepetersen_, Shaughnessy119, amanda0x, j0hnwang, sjdedic, jonathankingvc, alexgedevani, NaytheForceBwU, mattyryze, zacxbt, AustinBarack",20,https://x.com/i/user/1381965565615468544
3985891,Will Wolf ✌🏻 🚀,Tue Apr 10 05:06:33 +0000 2007,"QwQiao, KyleSamani, grisacerne, stutireal, Darrenlautf, 0xminion, reganbozman, andyisnotandy, panekkkk, Shaughnessy119, j0hnwang, cooper_kunz, sjdedic, sjrosenblum, MariaShen, AustinBarack, roybitsir, GrantStenger, tomhschmidt",19,https://x.com/i/user/3985891
1400381995558047749,apix🎮,Thu Jun 03 09:21:06 +0000 2021,"QwQiao, 0xWenMoon, 0xminion, ishanee_, Daryllautk, andyisnotandy, benlakoff, Mikey0x_, pet3rpan_, eclecticcapital, amanda0x, j0hnwang, krybharat, samoyedali, 0xChanglu, Solofunk30, alexgedevani, thetinaverse, mattyryze, zacxbt, gregohr12",21,https://x.com/i/user/1400381995558047749
862740772847837184,edgar,Thu May 11 18:46:44 +0000 2017,"QwQiao, KyleSamani, 0xminion, Daryllautk, sandraaleow, andyisnotandy, OuroborosCap8, lmrankhan, j0hnwang, Sh_ivam, 0xMaki, ceterispar1bus, samoyedali, 0xChanglu, caitlinxyz, gakonst, jnwng, mattyryze, GrantStenger, tomhschmidt, kapursanat",21,https://x.com/i/user/862740772847837184
1476696261222936577,Milk Road,Thu Dec 30 23:26:54 +0000 2021,"QwQiao, KyleSamani, 0xminion, Daryllautk, wkhosrowshahi1, andyisnotandy, 0xKofi, caseykcaruso, bridge__harris, j0hnwang, jonathankingvc, Sh_ivam, samoyedali, caitlinxyz, alexgedevani, pokeapallascat, jnwng, thetinaverse, MariaShen, mattyryze, GrantStenger",21,https://x.com/i/user/1476696261222936577
906870773066772480,BitMEX Research,Sun Sep 10 13:23:35 +0000 2017,"QwQiao, KyleSamani, Darrenlautf, 0xminion, janehk, Daryllautk, wkhosrowshahi1, andyisnotandy, panekkkk, Yedidbotton, geenty, lmrankhan, j0hnwang, jennyqcheng, Sh_ivam, ceterispar1bus, AustinBarack, GrantStenger, kapursanat",19,https://x.com/i/user/906870773066772480
1044207764212518912,Jacquelyn Melinek,Mon Sep 24 12:51:46 +0000 2018,"QwQiao, stutireal, Darrenlautf, janehk, wkhosrowshahi1, andyisnotandy, benlakoff, panekkkk, lmrankhan, j0hnwang, jonathankingvc, Sh_ivam, yekiM_o, NaytheForceBwU, jnwng, MariaShen, mattyryze, AustinBarack, tomhschmidt",19,https://x.com/i/user/1044207764212518912
12638192,benchow.sol,Thu Jan 24 13:28:25 +0000 2008,"QwQiao, KyleSamani, Darrenlautf, 0xminion, Daryllautk, YeouJie, benlakoff, lmrankhan, j0hnwang, CryptoSources, jonathankingvc, 0xMaki, 0xChanglu, pokeapallascat, jnwng, mattyryze, zacxbt, AustinBarack, GrantStenger",19,https://x.com/i/user/12638192
