id,name,register_date,followed_by,followers_count
2423897114,Jiani Chen,Wed Apr 02 14:29:37 +0000 2014,"serg_xyz, KyleSamani, stutireal, ishanee_, rishisthinking, 0xRainandCoffee, andyisnotandy, benlakoff, pet3rpan_, bridge__harris, Louissongyz, Shaughnessy119, firstc0in, jonathankingvc, 0xMaki, alexgedevani, jnwng, mattyryze, kapursanat",19
4394667015,lucacs,Sun Dec 06 14:25:02 +0000 2015,"serg_xyz, NTmoney, Darrenlautf, ishanee_, Daryllautk, sandraaleow, andyisnotandy, Mikey0x_, j0hnwang, krybharat, lapgandhi, 0xMaki, 0xdetweiler, samoyedali, caitlinxyz, Solofunk30, alexgedevani, zacxbt, kapursanat, 0xbilly",20
910620024506896384,Pedr◎ 🇧🇷,Wed Sep 20 21:41:47 +0000 2017,"serg_xyz, KyleSamani, 0xWenMoon, rishisthinking, wkhosrowshahi1, masonnystrom, eclecticcapital, Shaughnessy119, amanda0x, lmrankhan, j0hnwang, 0xChanglu, alexgedevani, NaytheForceBwU, jnwng, mattyryze, zacxbt, AustinBarack, GrantStenger",19
3003398068,justinaversano,Wed Jan 28 15:29:55 +0000 2015,"serg_xyz, NTmoney, Darrenlautf, 0xminion, janehk, benlakoff, pet3rpan_, Shaughnessy119, lmrankhan, j0hnwang, krybharat, 0xMaki, yekiM_o, 0xChanglu, alexgedevani, MariaShen, mattyryze, kapursanat, 0xbilly",19
92477301,Ryan Kim,Wed Nov 25 08:21:50 +0000 2009,"serg_xyz, QwQiao, KyleSamani, Darrenlautf, 0xminion, kidponga, janehk, YeouJie, pet3rpan_, panekkkk, tkstanczak, lmrankhan, sjdedic, lapgandhi, 0xMaki, samoyedali, 0xChanglu, mattyryze, roybitsir, tomhschmidt",20
897890544613040128,Rocco,Wed Aug 16 18:39:22 +0000 2017,"serg_xyz, KyleSamani, Darrenlautf, 0xminion, janehk, reganbozman, masonnystrom, Mikey0x_, panekkkk, AliceL991, Shaughnessy119, geenty, n4motto, alexgedevani, MariaShen, mattyryze, roybitsir, delitzer, tomhschmidt, 0xbilly",20
1285527355163721730,ish,Tue Jul 21 10:49:58 +0000 2020,"serg_xyz, grisacerne, OmniscientAsian, stutireal, 0xminion, kidponga, YeouJie, masonnystrom, andyisnotandy, Louissongyz, eclecticcapital, lmrankhan, jennyqcheng, Sh_ivam, 0xMaki, 0xChanglu, mattyryze, delitzer, kapursanat",19
372650546,sacha 🦣,Tue Sep 13 04:51:11 +0000 2011,"serg_xyz, 0xRaghav, KyleSamani, kidponga, 0xRainandCoffee, eclecticcapital, Shaughnessy119, ncerovac, cooper_kunz, lapgandhi, 0xMaki, yekiM_o, ceterispar1bus, samoyedali, n4motto, thetinaverse, MariaShen, mattyryze, roybitsir",19
39592581,chrislyons,Tue May 12 20:50:50 +0000 2009,"serg_xyz, NTmoney, Darrenlautf, 0xminion, janehk, amanda0x, j0hnwang, sjdedic, jonathankingvc, HoolieG, sjrosenblum, yekiM_o, 0xChanglu, alexgedevani, MariaShen, mattyryze, AustinBarack, roybitsir, delitzer",19
14161568,Sonal Chokshi,Mon Mar 17 05:34:28 +0000 2008,"serg_xyz, NTmoney, Darrenlautf, janehk, rishisthinking, 0xRainandCoffee, masonnystrom, andyisnotandy, Mikey0x_, lmrankhan, Sh_ivam, HoolieG, sjrosenblum, n4motto, caitlinxyz, alexgedevani, MariaShen, mattyryze, kapursanat",19
951232673296601088,lior.eth (Lior Messika),Wed Jan 10 23:21:57 +0000 2018,"serg_xyz, NTmoney, stutireal, janehk, rishisthinking, YeouJie, masonnystrom, benlakoff, SimaoCCruz, robbiepetersen_, Shaughnessy119, krybharat, sjdedic, jonathankingvc, lapgandhi, 0xMaki, samoyedali, MariaShen, mattyryze, zacxbt",20
245556369,superoo7,Mon Jan 31 23:39:51 +0000 2011,"0xRaghav, OmniscientAsian, Darrenlautf, 0xminion, rishisthinking, sandraaleow, YeouJie, benlakoff, Mikey0x_, Shaughnessy119, lapgandhi, Sh_ivam, 0xMaki, 0xdetweiler, gakonst, alexgedevani, mattyryze, AustinBarack, 0xbilly",19
1237411,David Marcus,Thu Mar 15 18:09:53 +0000 2007,"0xRaghav, KyleSamani, janehk, SimaoCCruz, eclecticcapital, panekkkk, tkstanczak, Yedidbotton, lmrankhan, j0hnwang, Sh_ivam, HoolieG, sjrosenblum, NaytheForceBwU, MariaShen, mattyryze, zacxbt, AustinBarack, roybitsir",19
1484922694651060235,alexander,Sat Jan 22 16:17:05 +0000 2022,"0xRaghav, Darrenlautf, 0xWenMoon, Daryllautk, sandraaleow, wkhosrowshahi1, masonnystrom, andyisnotandy, pet3rpan_, cosmo_jiang, OuroborosCap8, amanda0x, notnotstorm, jonathankingvc, 0xMaki, HoolieG, yekiM_o, Solofunk30, mattyryze, AustinBarack",20
1029230643513679872,Dev 🧪,Tue Aug 14 04:58:02 +0000 2018,"0xRaghav, KyleSamani, NTmoney, rishisthinking, eclecticcapital, panekkkk, j0hnwang, _weidai, lapgandhi, 0xMaki, ceterispar1bus, samoyedali, n4motto, gakonst, MariaShen, mattyryze, roybitsir, delitzer, kapursanat",19
4727130589,Anurag Arjun,Fri Jan 08 06:29:39 +0000 2016,"0xRaghav, KyleSamani, 0xminion, kidponga, rishisthinking, 0xRainandCoffee, YeouJie, andyisnotandy, bridge__harris, Louissongyz, lmrankhan, j0hnwang, _weidai, lapgandhi, Sh_ivam, 0xMaki, mattyryze, zacxbt, kapursanat",19
1151977130332434433,=nil; Foundation,Thu Jul 18 22:08:45 +0000 2019,"0xRaghav, OmniscientAsian, Darrenlautf, 0xminion, rishisthinking, andyisnotandy, Shaughnessy119, firstc0in, j0hnwang, lapgandhi, 0xMaki, 0xdetweiler, ceterispar1bus, alexgedevani, mattyryze, roybitsir, GrantStenger, kapursanat, 0xbilly",19
513341499,A₿del ∞/21M,Sat Mar 03 16:28:50 +0000 2012,"0xRaghav, KyleSamani, Darrenlautf, 0xminion, andyisnotandy, BigBrainKasey, Louissongyz, tkstanczak, geenty, j0hnwang, _weidai, sjdedic, lapgandhi, 0xMaki, gakonst, alexgedevani, mattyryze, zacxbt, GrantStenger",19
1270993847036805121,Ishan B,Thu Jun 11 08:18:52 +0000 2020,"0xRaghav, OmniscientAsian, 0xminion, kidponga, andyisnotandy, Shaughnessy119, amanda0x, geenty, lmrankhan, j0hnwang, CryptoSources, lapgandhi, 0xMaki, 0xdetweiler, mattyryze, AustinBarack, TaikiMaeda2, delitzer, 0xbilly",19
1089885302750150656,lukasschor.eth,Mon Jan 28 13:58:00 +0000 2019,"0xRaghav, 0xminion, ishanee_, rishisthinking, pet3rpan_, SimaoCCruz, Shaughnessy119, tkstanczak, j0hnwang, _weidai, ncerovac, sjdedic, lapgandhi, 0xMaki, ceterispar1bus, MariaShen, mattyryze, tomhschmidt, 0xbilly",19
1004162476273893377,Figment,Wed Jun 06 00:46:05 +0000 2018,"0xRaghav, grisacerne, OmniscientAsian, Darrenlautf, 0xminion, janehk, 0xRainandCoffee, wkhosrowshahi1, andyisnotandy, BigBrainKasey, geenty, Sh_ivam, 0xMaki, Solofunk30, MariaShen, mattyryze, AustinBarack, roybitsir, kapursanat",19
14985734,billy,Mon Jun 02 21:58:45 +0000 2008,"0xRaghav, KyleSamani, 0xRainandCoffee, Mikey0x_, pet3rpan_, SimaoCCruz, eclecticcapital, j0hnwang, _weidai, ncerovac, 0xMaki, yekiM_o, ceterispar1bus, samoyedali, gakonst, alexgedevani, mattyryze, roybitsir, tomhschmidt",19
210384083,emmacui,Sun Oct 31 09:28:40 +0000 2010,"0xRaghav, QwQiao, 0xminion, janehk, rishisthinking, YeouJie, andyisnotandy, benlakoff, pet3rpan_, bridge__harris, Shaughnessy119, sjdedic, jennyqcheng, lapgandhi, 0xMaki, 0xChanglu, n4motto, mattyryze, AustinBarack",19
1111529709739765760,LongHash Ventures,Fri Mar 29 07:25:08 +0000 2019,"0xRaghav, KyleSamani, Darrenlautf, 0xminion, janehk, rishisthinking, 0xRainandCoffee, YeouJie, andyisnotandy, benlakoff, AliceL991, Shaughnessy119, j0hnwang, sjdedic, lapgandhi, Sh_ivam, mattyryze, zacxbt, AustinBarack",19
914061,Aaron Levie,Sun Mar 11 09:25:44 +0000 2007,"QwQiao, stutireal, reganbozman, SimaoCCruz, robbiepetersen_, lmrankhan, j0hnwang, jonathankingvc, HoolieG, 0xChanglu, alexgedevani, jnwng, MariaShen, mattyryze, zacxbt, delitzer, GrantStenger, tomhschmidt, 0xbilly",19
738803172991373312,Initialized Capital,Fri Jun 03 18:42:57 +0000 2016,"QwQiao, Darrenlautf, 0xminion, janehk, sandraaleow, YeouJie, panekkkk, lmrankhan, j0hnwang, krybharat, ncerovac, jonathankingvc, HoolieG, jnwng, MariaShen, mattyryze, AustinBarack, roybitsir, 0xbilly",19
1252390833418092544,Jarry Xiao 🐦‍🔥🌐,Tue Apr 21 00:17:09 +0000 2020,"QwQiao, KyleSamani, Daryllautk, wkhosrowshahi1, BigBrainKasey, eclecticcapital, notnotstorm, j0hnwang, lapgandhi, 0xMaki, sjrosenblum, ceterispar1bus, n4motto, caitlinxyz, gakonst, jnwng, thetinaverse, MariaShen, mattyryze, zacxbt",20
18536658,amir 🎈,Thu Jan 01 21:23:51 +0000 2009,"QwQiao, KyleSamani, 0xminion, kidponga, janehk, masonnystrom, cosmo_jiang, amanda0x, lmrankhan, j0hnwang, krybharat, jonathankingvc, Sh_ivam, 0xdetweiler, NaytheForceBwU, jnwng, mattyryze, AustinBarack, TaikiMaeda2",19
334881556,avery.apt 🌐,Wed Jul 13 20:23:31 +0000 2011,"QwQiao, KyleSamani, 0xminion, janehk, rishisthinking, andyisnotandy, benlakoff, OuroborosCap8, lmrankhan, j0hnwang, CryptoSources, jonathankingvc, lapgandhi, Sh_ivam, MariaShen, mattyryze, AustinBarack, GrantStenger, tomhschmidt",19
12638192,benchow.sol,Thu Jan 24 13:28:25 +0000 2008,"QwQiao, KyleSamani, Darrenlautf, 0xminion, Daryllautk, YeouJie, benlakoff, lmrankhan, j0hnwang, CryptoSources, jonathankingvc, 0xMaki, 0xChanglu, pokeapallascat, jnwng, mattyryze, zacxbt, AustinBarack, GrantStenger",19
2453361,⚔️ SIONG,Tue Mar 27 10:20:55 +0000 2007,"QwQiao, KyleSamani, Darrenlautf, 0xminion, Daryllautk, sandraaleow, eclecticcapital, lmrankhan, j0hnwang, jonathankingvc, lapgandhi, Sh_ivam, sjrosenblum, ceterispar1bus, caitlinxyz, jnwng, mattyryze, AustinBarack, GrantStenger",19
1008904399941525504,Sam Sends,Tue Jun 19 02:48:48 +0000 2018,"QwQiao, KyleSamani, Darrenlautf, 0xminion, janehk, sandraaleow, masonnystrom, andyisnotandy, pet3rpan_, panekkkk, Shaughnessy119, lmrankhan, j0hnwang, HoolieG, yekiM_o, jnwng, mattyryze, roybitsir, delitzer",19
14628341,dima.eth,Fri May 02 17:15:27 +0000 2008,"QwQiao, KyleSamani, NTmoney, Darrenlautf, 0xminion, pet3rpan_, panekkkk, lmrankhan, j0hnwang, krybharat, ncerovac, jonathankingvc, 0xMaki, alexgedevani, mattyryze, zacxbt, AustinBarack, tomhschmidt, 0xbilly",19
938987291199942657,Nathan Allman 🌊,Fri Dec 08 04:23:10 +0000 2017,"QwQiao, KyleSamani, stutireal, Darrenlautf, janehk, sandraaleow, wkhosrowshahi1, pet3rpan_, bridge__harris, Shaughnessy119, geenty, notnotstorm, j0hnwang, lapgandhi, Sh_ivam, Solofunk30, jnwng, mattyryze, tomhschmidt",19
1293904122605760513,BoringCrypto,Thu Aug 13 13:36:29 +0000 2020,"QwQiao, OmniscientAsian, Darrenlautf, 0xWenMoon, 0xminion, ishanee_, geenty, j0hnwang, krybharat, ncerovac, 0xMaki, ceterispar1bus, n4motto, alexgedevani, mattyryze, AustinBarack, roybitsir, kapursanat, 0xbilly",19
1126067837569617921,Casino Royale,Wed May 08 10:14:28 +0000 2019,"QwQiao, KyleSamani, Darrenlautf, 0xminion, janehk, reganbozman, Daryllautk, YeouJie, OuroborosCap8, panekkkk, lmrankhan, j0hnwang, ncerovac, 0xMaki, alexgedevani, MariaShen, mattyryze, zacxbt, roybitsir, 0xbilly",20
18509311,gavin,Wed Dec 31 16:15:04 +0000 2008,"QwQiao, KyleSamani, OmniscientAsian, Darrenlautf, 0xminion, janehk, Daryllautk, wkhosrowshahi1, panekkkk, geenty, lmrankhan, 0xMaki, gakonst, alexgedevani, MariaShen, mattyryze, roybitsir, delitzer, tomhschmidt",19
837854453109665796,Sid Powell 🥞,Sat Mar 04 02:37:23 +0000 2017,"QwQiao, 0xminion, kidponga, janehk, wkhosrowshahi1, andyisnotandy, pet3rpan_, cosmo_jiang, panekkkk, Shaughnessy119, firstc0in, j0hnwang, lapgandhi, Sh_ivam, 0xMaki, mattyryze, zacxbt, AustinBarack, tomhschmidt",19
1154010518790791168,High Stakes Capital,Wed Jul 24 12:48:42 +0000 2019,"QwQiao, OmniscientAsian, Darrenlautf, 0xminion, sandraaleow, YeouJie, cosmo_jiang, OuroborosCap8, geenty, krybharat, 0xdetweiler, 0xChanglu, n4motto, gakonst, alexgedevani, mattyryze, zacxbt, TaikiMaeda2, kapursanat, 0xbilly",20
5686612,Maya Zehavi,Tue May 01 14:28:01 +0000 2007,"QwQiao, KyleSamani, janehk, andyisnotandy, OuroborosCap8, panekkkk, Shaughnessy119, lmrankhan, notnotstorm, j0hnwang, cooper_kunz, ceterispar1bus, gakonst, alexgedevani, MariaShen, mattyryze, roybitsir, tomhschmidt, kapursanat",19
27868000,David Nage🎯,Tue Mar 31 13:24:50 +0000 2009,"QwQiao, KyleSamani, Darrenlautf, janehk, andyisnotandy, benlakoff, SimaoCCruz, panekkkk, robbiepetersen_, Shaughnessy119, lmrankhan, j0hnwang, 0xMaki, alexgedevani, MariaShen, mattyryze, AustinBarack, delitzer, tomhschmidt",19
1438753098,Spenser Huang,Sat May 18 16:09:35 +0000 2013,"QwQiao, KyleSamani, reganbozman, Daryllautk, YeouJie, Mikey0x_, pet3rpan_, caseykcaruso, lmrankhan, j0hnwang, ncerovac, jonathankingvc, lapgandhi, yekiM_o, ceterispar1bus, samoyedali, mattyryze, GrantStenger, tomhschmidt",19
1833946076,neil,Sun Sep 08 20:09:56 +0000 2013,"KyleSamani, OmniscientAsian, Darrenlautf, 0xminion, ishanee_, janehk, rishisthinking, YeouJie, BigBrainKasey, Yedidbotton, j0hnwang, CryptoSources, jennyqcheng, lapgandhi, sjrosenblum, ceterispar1bus, n4motto, alexgedevani, tomhschmidt",19
1336191614356742144,tervo,Tue Dec 08 06:12:15 +0000 2020,"KyleSamani, Darrenlautf, 0xminion, reganbozman, 0xRainandCoffee, andyisnotandy, eclecticcapital, amanda0x, lmrankhan, j0hnwang, krybharat, CryptoSources, 0xdetweiler, ceterispar1bus, alexgedevani, NaytheForceBwU, mattyryze, zacxbt, GrantStenger",19
1448644422380310537,Tom Wan,Thu Oct 14 13:38:45 +0000 2021,"KyleSamani, grisacerne, 0xminion, sandraaleow, andyisnotandy, 0xKofi, OuroborosCap8, notnotstorm, Sh_ivam, 0xMaki, ceterispar1bus, Solofunk30, alexgedevani, NaytheForceBwU, mattyryze, zacxbt, AustinBarack, delitzer, tomhschmidt",19
1195055776471175169,brain genius,Thu Nov 14 19:07:58 +0000 2019,"KyleSamani, NTmoney, reganbozman, sandraaleow, YeouJie, benlakoff, cosmo_jiang, j0hnwang, CryptoSources, HoolieG, 0xdetweiler, alexgedevani, MariaShen, mattyryze, zacxbt, AustinBarack, roybitsir, kapursanat, 0xbilly",19
36425256,Happy Norswap 🤠🏴‍☠️✨,Wed Apr 29 17:58:46 +0000 2009,"KyleSamani, grisacerne, 0xminion, Daryllautk, 0xRainandCoffee, sandraaleow, andyisnotandy, pet3rpan_, 0xKofi, Louissongyz, tkstanczak, notnotstorm, j0hnwang, lapgandhi, 0xMaki, samoyedali, n4motto, kapursanat, 0xbilly",19
206935193,David Attermann,Sun Oct 24 03:01:23 +0000 2010,"KyleSamani, kidponga, 0xRainandCoffee, YeouJie, masonnystrom, andyisnotandy, cosmo_jiang, robbiepetersen_, Shaughnessy119, amanda0x, firstc0in, krybharat, jonathankingvc, ceterispar1bus, Solofunk30, alexgedevani, mattyryze, zacxbt, AustinBarack",19
1512518742051237893,DRiP 💧,Fri Apr 08 19:52:34 +0000 2022,"KyleSamani, kidponga, janehk, reganbozman, sandraaleow, andyisnotandy, BigBrainKasey, eclecticcapital, j0hnwang, krybharat, jonathankingvc, lapgandhi, Sh_ivam, alexgedevani, NaytheForceBwU, jnwng, mattyryze, zacxbt, AustinBarack",19
763026986600194052,Omer Goldberg,Tue Aug 09 14:59:44 +0000 2016,"KyleSamani, 0xminion, janehk, rishisthinking, panekkkk, Shaughnessy119, firstc0in, lmrankhan, j0hnwang, jonathankingvc, lapgandhi, 0xMaki, sjrosenblum, MariaShen, mattyryze, zacxbt, roybitsir, delitzer, GrantStenger",19
1175974820858798083,seth bloomberg,Mon Sep 23 03:27:41 +0000 2019,"KyleSamani, Darrenlautf, 0xRainandCoffee, YeouJie, masonnystrom, eclecticcapital, Shaughnessy119, amanda0x, jonathankingvc, Sh_ivam, HoolieG, Solofunk30, alexgedevani, NaytheForceBwU, mattyryze, zacxbt, AustinBarack, gregohr12, tomhschmidt",19
161682347,Peter | Reservoir,Thu Jul 01 13:45:16 +0000 2010,"KyleSamani, 0xminion, masonnystrom, pet3rpan_, 0xKofi, AliceL991, amanda0x, 0xMaki, HoolieG, 0xdetweiler, yekiM_o, caitlinxyz, alexgedevani, MariaShen, mattyryze, zacxbt, delitzer, tomhschmidt, kapursanat",19
1407411848446611459,Solana Foundation,Tue Jun 22 18:55:13 +0000 2021,"KyleSamani, 0xminion, janehk, sandraaleow, amanda0x, j0hnwang, sjdedic, jonathankingvc, Sh_ivam, 0xMaki, 0xChanglu, Solofunk30, NaytheForceBwU, jnwng, mattyryze, zacxbt, AustinBarack, roybitsir, GrantStenger",19
1126018087,tom 🐵,Sun Jan 27 19:36:30 +0000 2013,"KyleSamani, OmniscientAsian, Darrenlautf, 0xminion, janehk, Daryllautk, sandraaleow, YeouJie, j0hnwang, 0xMaki, sjrosenblum, 0xChanglu, gakonst, alexgedevani, jnwng, thetinaverse, mattyryze, AustinBarack, roybitsir, kapursanat",20
866379494319378439,Cem | Sovereign,Sun May 21 19:45:42 +0000 2017,"KyleSamani, janehk, 0xRainandCoffee, masonnystrom, Louissongyz, eclecticcapital, panekkkk, Shaughnessy119, tkstanczak, j0hnwang, _weidai, lapgandhi, Sh_ivam, 0xMaki, sjrosenblum, ceterispar1bus, n4motto, mattyryze, kapursanat, 0xbilly",20
1382682373368713224,Neon Labs,Thu Apr 15 13:09:20 +0000 2021,"KyleSamani, Darrenlautf, 0xminion, janehk, AliceL991, j0hnwang, CryptoSources, jonathankingvc, lapgandhi, 0xMaki, ceterispar1bus, gakonst, alexgedevani, jnwng, MariaShen, mattyryze, zacxbt, AustinBarack, roybitsir",19
1153167226729406465,Rook,Mon Jul 22 04:57:46 +0000 2019,"KyleSamani, Darrenlautf, kidponga, janehk, andyisnotandy, eclecticcapital, lmrankhan, j0hnwang, ncerovac, jonathankingvc, lapgandhi, Sh_ivam, ceterispar1bus, alexgedevani, NaytheForceBwU, mattyryze, AustinBarack, roybitsir, 0xbilly",19
15858184,Trev🙃r,Fri Aug 15 01:14:05 +0000 2008,"KyleSamani, 0xminion, janehk, andyisnotandy, benlakoff, pet3rpan_, j0hnwang, ncerovac, sjrosenblum, yekiM_o, caitlinxyz, alexgedevani, MariaShen, mattyryze, zacxbt, AustinBarack, roybitsir, tomhschmidt, 0xbilly",19
1315718962093658118,DELV ᛋ,Mon Oct 12 18:20:34 +0000 2020,"KyleSamani, OmniscientAsian, Darrenlautf, 0xWenMoon, 0xminion, janehk, Daryllautk, sandraaleow, Louissongyz, geenty, j0hnwang, ncerovac, 0xMaki, ceterispar1bus, samoyedali, mattyryze, roybitsir, TaikiMaeda2, 0xbilly",19
1232540254457847808,Foundation 🌐,Wed Feb 26 05:37:57 +0000 2020,"KyleSamani, 0xminion, janehk, sandraaleow, andyisnotandy, bridge__harris, eclecticcapital, panekkkk, j0hnwang, krybharat, ncerovac, HoolieG, alexgedevani, MariaShen, mattyryze, AustinBarack, roybitsir, tomhschmidt, 0xbilly",19
1201627105085329411,Recall,Mon Dec 02 22:20:15 +0000 2019,"KyleSamani, 0xminion, janehk, reganbozman, andyisnotandy, AliceL991, j0hnwang, ncerovac, 0xMaki, yekiM_o, samoyedali, alexgedevani, mattyryze, zacxbt, AustinBarack, roybitsir, gregohr12, kapursanat, 0xbilly",19
384144651,cuban 🍂,Mon Oct 03 04:35:49 +0000 2011,"KyleSamani, OmniscientAsian, Darrenlautf, 0xminion, ishanee_, Daryllautk, YeouJie, andyisnotandy, OuroborosCap8, geenty, lmrankhan, j0hnwang, 0xMaki, 0xdetweiler, alexgedevani, MariaShen, mattyryze, tomhschmidt, 0xbilly",19
5731752,Wil Barnes,Thu May 03 05:23:31 +0000 2007,"KyleSamani, OmniscientAsian, Darrenlautf, 0xminion, janehk, sandraaleow, YeouJie, panekkkk, geenty, j0hnwang, 0xMaki, ceterispar1bus, n4motto, gakonst, MariaShen, mattyryze, AustinBarack, kapursanat, 0xbilly",19
1295428909538906115,TTI,Mon Aug 17 18:35:01 +0000 2020,"KyleSamani, luffistotle, OmniscientAsian, Darrenlautf, 0xminion, reganbozman, Daryllautk, YeouJie, SimaoCCruz, panekkkk, j0hnwang, ncerovac, 0xdetweiler, ceterispar1bus, 0xChanglu, alexgedevani, MariaShen, mattyryze, tomhschmidt",19
8028722,YO,Tue Aug 07 15:36:56 +0000 2007,"KyleSamani, Darrenlautf, 0xminion, janehk, andyisnotandy, panekkkk, j0hnwang, ncerovac, lapgandhi, 0xMaki, ceterispar1bus, samoyedali, gakonst, alexgedevani, MariaShen, mattyryze, zacxbt, roybitsir, 0xbilly",19
1222368733227880448,0MOLLY WINTERMUT3,Wed Jan 29 04:00:23 +0000 2020,"KyleSamani, Darrenlautf, 0xWenMoon, 0xminion, reganbozman, Daryllautk, masonnystrom, OuroborosCap8, panekkkk, j0hnwang, 0xMaki, sjrosenblum, MariaShen, mattyryze, zacxbt, AustinBarack, delitzer, kapursanat, 0xbilly",19
976884195632001027,Fidelity Digital Assets,Thu Mar 22 18:11:56 +0000 2018,"KyleSamani, 0xminion, janehk, wkhosrowshahi1, benlakoff, panekkkk, geenty, lmrankhan, j0hnwang, jonathankingvc, Sh_ivam, ceterispar1bus, Solofunk30, NaytheForceBwU, MariaShen, mattyryze, AustinBarack, roybitsir, kapursanat",19
7976822,RAC,Sun Aug 05 18:51:03 +0000 2007,"KyleSamani, Darrenlautf, 0xminion, janehk, reganbozman, masonnystrom, benlakoff, pet3rpan_, panekkkk, j0hnwang, ncerovac, 0xMaki, 0xChanglu, MariaShen, mattyryze, zacxbt, roybitsir, tomhschmidt, 0xbilly",19
898506662943883268,Charles Read,Fri Aug 18 11:27:36 +0000 2017,"KyleSamani, luffistotle, Darrenlautf, 0xminion, janehk, Daryllautk, sandraaleow, benlakoff, panekkkk, Shaughnessy119, j0hnwang, sjdedic, 0xMaki, alexgedevani, mattyryze, zacxbt, AustinBarack, roybitsir, 0xbilly",19
23503850,Payom Dousti 🦥,Mon Mar 09 21:22:24 +0000 2009,"KyleSamani, stutireal, Darrenlautf, 0xminion, janehk, masonnystrom, lmrankhan, j0hnwang, 0xMaki, sjrosenblum, n4motto, caitlinxyz, gakonst, MariaShen, mattyryze, roybitsir, delitzer, tomhschmidt, kapursanat",19
43775786,Dave Portnoy,Sun May 31 23:08:06 +0000 2009,"KyleSamani, luffistotle, janehk, reganbozman, YeouJie, Shaughnessy119, lmrankhan, j0hnwang, CryptoSources, RyanKSterling, 0xdetweiler, yekiM_o, 0xChanglu, n4motto, alexgedevani, MariaShen, mattyryze, zacxbt, tomhschmidt, 0xbilly",20
927405023369224192,Richard Galvin,Mon Nov 06 05:19:22 +0000 2017,"KyleSamani, Darrenlautf, 0xminion, kidponga, YeouJie, SimaoCCruz, Shaughnessy119, tkstanczak, j0hnwang, krybharat, jennyqcheng, Sh_ivam, 0xMaki, ceterispar1bus, mattyryze, zacxbt, TaikiMaeda2, kapursanat, 0xbilly",19
1154795176507969543,🌪️ Tornado.cash 🌪️,Fri Jul 26 16:46:39 +0000 2019,"KyleSamani, OmniscientAsian, 0xminion, kidponga, janehk, tkstanczak, firstc0in, geenty, j0hnwang, ncerovac, CryptoSources, jonathankingvc, 0xMaki, ceterispar1bus, alexgedevani, MariaShen, mattyryze, tomhschmidt, 0xbilly",19
18989355,Mike Solana,Wed Jan 14 18:51:30 +0000 2009,"KyleSamani, luffistotle, janehk, wkhosrowshahi1, benlakoff, bridge__harris, panekkkk, robbiepetersen_, lmrankhan, j0hnwang, sjdedic, HoolieG, sjrosenblum, 0xChanglu, alexgedevani, MariaShen, mattyryze, tomhschmidt, 0xbilly",19
1069285955549442054,UMA,Sun Dec 02 17:43:32 +0000 2018,"KyleSamani, Darrenlautf, 0xWenMoon, 0xminion, janehk, panekkkk, j0hnwang, krybharat, Sh_ivam, 0xMaki, HoolieG, Solofunk30, MariaShen, mattyryze, zacxbt, AustinBarack, roybitsir, tomhschmidt, 0xbilly",19
82598830,Remco,Thu Oct 15 11:51:24 +0000 2009,"KyleSamani, luffistotle, janehk, 0xRainandCoffee, wkhosrowshahi1, OuroborosCap8, panekkkk, lmrankhan, notnotstorm, j0hnwang, _weidai, lapgandhi, 0xMaki, gakonst, mattyryze, roybitsir, delitzer, tomhschmidt, kapursanat",19
714534276,Mike McDonald,Tue Jul 24 16:16:23 +0000 2012,"KyleSamani, NTmoney, 0xminion, janehk, Daryllautk, masonnystrom, panekkkk, lmrankhan, j0hnwang, 0xMaki, gakonst, alexgedevani, MariaShen, mattyryze, roybitsir, delitzer, tomhschmidt, kapursanat, 0xbilly",19
1465880802,Lex Sokolin | Generative Ventures,Tue May 28 23:17:34 +0000 2013,"KyleSamani, Darrenlautf, 0xminion, janehk, wkhosrowshahi1, andyisnotandy, panekkkk, Shaughnessy119, tkstanczak, j0hnwang, sjdedic, lapgandhi, Sh_ivam, 0xMaki, MariaShen, mattyryze, zacxbt, tomhschmidt, 0xbilly",19
122235629,Ella Zhang,Fri Mar 12 01:58:20 +0000 2010,"KyleSamani, OmniscientAsian, 0xminion, janehk, rishisthinking, reganbozman, YeouJie, panekkkk, amanda0x, lmrankhan, j0hnwang, sjdedic, jennyqcheng, Sh_ivam, MariaShen, mattyryze, zacxbt, roybitsir, delitzer",19
2319408132,Marguerite,Thu Jan 30 19:22:59 +0000 2014,"KyleSamani, NTmoney, Darrenlautf, 0xminion, janehk, Daryllautk, masonnystrom, benlakoff, panekkkk, j0hnwang, krybharat, 0xChanglu, gakonst, alexgedevani, MariaShen, mattyryze, zacxbt, roybitsir, 0xbilly",19
341874816,Eric/,Mon Jul 25 03:06:56 +0000 2011,"KyleSamani, 0xminion, janehk, reganbozman, YeouJie, panekkkk, Shaughnessy119, geenty, j0hnwang, 0xMaki, alexgedevani, MariaShen, mattyryze, zacxbt, AustinBarack, roybitsir, delitzer, tomhschmidt, kapursanat, 0xbilly",20
7032982,Jamie Burke,Sat Jun 23 13:06:00 +0000 2007,"KyleSamani, Darrenlautf, 0xminion, rishisthinking, masonnystrom, andyisnotandy, benlakoff, panekkkk, robbiepetersen_, lmrankhan, notnotstorm, j0hnwang, sjdedic, alexgedevani, MariaShen, mattyryze, AustinBarack, roybitsir, 0xbilly",19
2631709828,notsofast,Sun Jun 22 15:45:53 +0000 2014,"KyleSamani, OmniscientAsian, Darrenlautf, 0xminion, janehk, 0xRainandCoffee, panekkkk, j0hnwang, krybharat, ncerovac, CryptoSources, 0xMaki, 0xdetweiler, ceterispar1bus, 0xChanglu, alexgedevani, MariaShen, mattyryze, zacxbt",19
34743251,SpaceX,Thu Apr 23 21:53:30 +0000 2009,"KyleSamani, luffistotle, kidponga, sandraaleow, panekkkk, lmrankhan, j0hnwang, op7418, ncerovac, jonathankingvc, HoolieG, sjrosenblum, Solofunk30, pokeapallascat, MariaShen, mattyryze, roybitsir, delitzer, 0xbilly",19
657863,Kevin Rose,Thu Jan 18 00:43:32 +0000 2007,"KyleSamani, reganbozman, masonnystrom, andyisnotandy, benlakoff, caseykcaruso, SimaoCCruz, amanda0x, ncerovac, 0xMaki, HoolieG, alexgedevani, jnwng, MariaShen, mattyryze, zacxbt, roybitsir, gregohr12, 0xbilly",19
238000010,St. Etiënne • TRGC,Fri Jan 14 03:50:10 +0000 2011,"grisacerne, OmniscientAsian, 0xminion, wkhosrowshahi1, YeouJie, benlakoff, BigBrainKasey, SimaoCCruz, Louissongyz, Shaughnessy119, firstc0in, sjdedic, jonathankingvc, lapgandhi, 0xMaki, alexgedevani, mattyryze, zacxbt, roybitsir",19
1313499304926023684,Tally,Tue Oct 06 15:20:33 +0000 2020,"grisacerne, OmniscientAsian, Darrenlautf, 0xminion, janehk, YeouJie, andyisnotandy, pet3rpan_, geenty, lmrankhan, j0hnwang, lapgandhi, Sh_ivam, 0xMaki, alexgedevani, MariaShen, mattyryze, roybitsir, 0xbilly",19
2914515430,Tom Emmer,Wed Dec 10 21:44:52 +0000 2014,"NTmoney, 0xminion, janehk, benlakoff, eclecticcapital, panekkkk, Shaughnessy119, Yedidbotton, notnotstorm, j0hnwang, Sh_ivam, HoolieG, samoyedali, Solofunk30, jnwng, MariaShen, mattyryze, zacxbt, 0xbilly",19
1251330667784232960,Dorothy,Sat Apr 18 02:04:22 +0000 2020,"OmniscientAsian, Darrenlautf, 0xWenMoon, 0xminion, rishisthinking, 0xRainandCoffee, sandraaleow, YeouJie, andyisnotandy, Louissongyz, OuroborosCap8, tkstanczak, jennyqcheng, 0xMaki, samoyedali, 0xChanglu, thetinaverse, mattyryze, kapursanat",19
1611429930272968705,Thanefield Research,Fri Jan 06 18:30:21 +0000 2023,"OmniscientAsian, Darrenlautf, 0xminion, kidponga, sandraaleow, YeouJie, andyisnotandy, Mikey0x_, j0hnwang, krybharat, sjdedic, Sh_ivam, n4motto, alexgedevani, MariaShen, AustinBarack, gregohr12, TaikiMaeda2, GrantStenger",19
6287362,Yeou Jie,Thu May 24 14:21:47 +0000 2007,"OmniscientAsian, Darrenlautf, 0xminion, 0xRainandCoffee, sandraaleow, Louissongyz, OuroborosCap8, Shaughnessy119, tkstanczak, j0hnwang, jennyqcheng, Sh_ivam, 0xMaki, samoyedali, mattyryze, zacxbt, AustinBarack, roybitsir, kapursanat",19
