id,name,register_date,followed_by,followers_count
1141179834,Hsin-Ju | Hack VC ⏩ Solana Accelerate,Sat Feb 02 01:36:22 +0000 2013,"serg_xyz, 0xRaghav, QwQiao, OmniscientAsian, Darrenlautf, 0xminion, janehk, Daryllautk, benlakoff, pet3rpan_, panekkkk, tkstanczak, lmrankhan, j0hnwang, ncerovac, 0xMaki, MariaShen, roybitsir, delitzer, tomhschmidt",20
1855822374345789440,dev.fun,Mon Nov 11 04:08:40 +0000 2024,"serg_xyz, 0xminion, Shaughnessy119, firstc0in, j0hnwang, jonathankingvc, jennyqcheng, lapgandhi, Sh_ivam, 0xMaki, 0xdetweiler, yekiM_o, samoyedali, alexgedevani, MariaShen, zacxbt, AustinBarack, roybitsir, gregohr12",19
864649212394438656,jae,Wed May 17 01:10:11 +0000 2017,"serg_xyz, QwQiao, 0xminion, janehk, Daryllautk, sandraaleow, masonnystrom, andyisnotandy, benlakoff, lmrankhan, j0hnwang, krybharat, CryptoSources, sjdedic, 0xMaki, 0xChanglu, AustinBarack, TaikiMaeda2, GrantStenger",19
152809943,Josh Cornelius,Sun Jun 06 23:17:00 +0000 2010,"serg_xyz, luffistotle, Darrenlautf, 0xminion, janehk, Daryllautk, sandraaleow, andyisnotandy, benlakoff, eclecticcapital, robbiepetersen_, amanda0x, j0hnwang, lapgandhi, samoyedali, alexgedevani, thetinaverse, MariaShen, zacxbt",19
991062733675225088,Ashwin,Mon Apr 30 21:12:23 +0000 2018,"serg_xyz, QwQiao, KyleSamani, Darrenlautf, 0xminion, janehk, Daryllautk, sandraaleow, masonnystrom, bridge__harris, panekkkk, firstc0in, lmrankhan, j0hnwang, 0xMaki, MariaShen, zacxbt, AustinBarack, roybitsir, delitzer, tomhschmidt",21
285901606,Jay,Fri Apr 22 00:33:06 +0000 2011,"serg_xyz, Darrenlautf, 0xminion, janehk, reganbozman, wkhosrowshahi1, Shaughnessy119, lmrankhan, cooper_kunz, jonathankingvc, lapgandhi, 0xMaki, HoolieG, samoyedali, caitlinxyz, alexgedevani, MariaShen, tomhschmidt, 0xbilly",19
92477301,Ryan Kim,Wed Nov 25 08:21:50 +0000 2009,"serg_xyz, QwQiao, KyleSamani, Darrenlautf, 0xminion, kidponga, janehk, YeouJie, pet3rpan_, panekkkk, tkstanczak, lmrankhan, sjdedic, lapgandhi, 0xMaki, samoyedali, 0xChanglu, roybitsir, tomhschmidt",19
519209521,Sid Coelho-Prabhu | sidcoin.eth 🛡️,Fri Mar 09 05:27:08 +0000 2012,"serg_xyz, QwQiao, NTmoney, OmniscientAsian, 0xminion, janehk, panekkkk, j0hnwang, ncerovac, AjeetK, jonathankingvc, 0xMaki, HoolieG, sjrosenblum, n4motto, jnwng, AustinBarack, roybitsir, tomhschmidt",19
465067650,Brandon Potts,Sun Jan 15 22:52:09 +0000 2012,"serg_xyz, grisacerne, stutireal, Darrenlautf, 0xminion, janehk, pet3rpan_, amanda0x, j0hnwang, sjdedic, jennyqcheng, Sh_ivam, 0xMaki, NaytheForceBwU, MariaShen, AustinBarack, roybitsir, delitzer, kapursanat, 0xbilly",20
1395628622417825795,Dariya Kho,Fri May 21 06:32:56 +0000 2021,"serg_xyz, 0xminion, janehk, reganbozman, benlakoff, pet3rpan_, bridge__harris, j0hnwang, jonathankingvc, lapgandhi, Sh_ivam, 0xMaki, sjrosenblum, yekiM_o, n4motto, alexgedevani, MariaShen, roybitsir, GrantStenger",19
897890544613040128,Rocco,Wed Aug 16 18:39:22 +0000 2017,"serg_xyz, KyleSamani, Darrenlautf, 0xminion, janehk, reganbozman, masonnystrom, Mikey0x_, panekkkk, AliceL991, Shaughnessy119, geenty, n4motto, alexgedevani, MariaShen, roybitsir, delitzer, tomhschmidt, 0xbilly",19
295105770,Gökhan,Sun May 08 11:21:29 +0000 2011,"serg_xyz, 0xRaghav, KyleSamani, stutireal, 0xWenMoon, 0xminion, kidponga, ishanee_, reganbozman, BigBrainKasey, Louissongyz, robbiepetersen_, tkstanczak, ncerovac, jonathankingvc, lapgandhi, 0xMaki, n4motto, alexgedevani, thetinaverse, MariaShen",21
1366753588047978500,ultra sound money 🦇🔊,Tue Mar 02 14:14:11 +0000 2021,"serg_xyz, NTmoney, 0xminion, kidponga, benlakoff, notnotstorm, j0hnwang, ncerovac, jonathankingvc, lapgandhi, Sh_ivam, 0xMaki, yekiM_o, samoyedali, alexgedevani, MariaShen, AustinBarack, tomhschmidt, 0xbilly",19
1140637286637473792,Biconomy,Mon Jun 17 15:08:15 +0000 2019,"serg_xyz, luffistotle, Darrenlautf, 0xminion, kidponga, janehk, andyisnotandy, OuroborosCap8, j0hnwang, krybharat, CryptoSources, lapgandhi, Sh_ivam, 0xMaki, alexgedevani, MariaShen, AustinBarack, roybitsir, GrantStenger",19
357312062,Bitcoin,Thu Aug 18 05:06:08 +0000 2011,"serg_xyz, KyleSamani, OmniscientAsian, 0xWenMoon, janehk, wkhosrowshahi1, andyisnotandy, benlakoff, Yedidbotton, lmrankhan, j0hnwang, CryptoSources, sjrosenblum, jnwng, MariaShen, zacxbt, AustinBarack, roybitsir, 0xbilly",19
934061151008251904,Fabric Ventures,Fri Nov 24 14:08:27 +0000 2017,"0xRaghav, luffistotle, 0xWenMoon, 0xminion, kidponga, janehk, reganbozman, wkhosrowshahi1, Louissongyz, eclecticcapital, panekkkk, robbiepetersen_, 0xdetweiler, samoyedali, alexgedevani, MariaShen, zacxbt, roybitsir, 0xbilly",19
265758342,YQ,Mon Mar 14 03:09:10 +0000 2011,"0xRaghav, Darrenlautf, 0xWenMoon, 0xminion, ishanee_, reganbozman, YeouJie, bridge__harris, Louissongyz, tkstanczak, lmrankhan, j0hnwang, lapgandhi, Sh_ivam, 0xMaki, 0xChanglu, zacxbt, AustinBarack, kapursanat",19
979462167559892993,Odysseus | phylax.systems,Thu Mar 29 20:55:53 +0000 2018,"0xRaghav, KyleSamani, stutireal, 0xminion, Daryllautk, 0xRainandCoffee, wkhosrowshahi1, benlakoff, robbiepetersen_, notnotstorm, j0hnwang, _weidai, ncerovac, lapgandhi, 0xMaki, gakonst, delitzer, kapursanat, 0xbilly",19
948821285257146368,josh lee,Thu Jan 04 07:39:57 +0000 2018,"0xRaghav, KyleSamani, NTmoney, 0xminion, janehk, Daryllautk, j0hnwang, jonathankingvc, lapgandhi, Sh_ivam, 0xMaki, yekiM_o, ceterispar1bus, samoyedali, alexgedevani, MariaShen, roybitsir, delitzer, GrantStenger",19
14946614,USV,Thu May 29 18:34:07 +0000 2008,"QwQiao, KyleSamani, 0xminion, janehk, reganbozman, wkhosrowshahi1, andyisnotandy, panekkkk, AliceL991, j0hnwang, jonathankingvc, lapgandhi, HoolieG, sjrosenblum, MariaShen, zacxbt, roybitsir, GrantStenger, 0xbilly",19
3985891,Will Wolf ✌🏻 🚀,Tue Apr 10 05:06:33 +0000 2007,"QwQiao, KyleSamani, grisacerne, stutireal, Darrenlautf, 0xminion, reganbozman, andyisnotandy, panekkkk, Shaughnessy119, j0hnwang, cooper_kunz, sjdedic, lapgandhi, sjrosenblum, MariaShen, AustinBarack, roybitsir, GrantStenger, tomhschmidt",20
906870773066772480,BitMEX Research,Sun Sep 10 13:23:35 +0000 2017,"QwQiao, KyleSamani, Darrenlautf, 0xminion, janehk, Daryllautk, wkhosrowshahi1, andyisnotandy, panekkkk, Yedidbotton, geenty, lmrankhan, j0hnwang, jennyqcheng, Sh_ivam, ceterispar1bus, AustinBarack, GrantStenger, kapursanat",19
1173810743654932480,joshua,Tue Sep 17 04:07:54 +0000 2019,"QwQiao, Darrenlautf, 0xminion, janehk, Daryllautk, 0xRainandCoffee, Mikey0x_, caseykcaruso, eclecticcapital, amanda0x, j0hnwang, lapgandhi, 0xMaki, 0xChanglu, caitlinxyz, gakonst, alexgedevani, delitzer, GrantStenger",19
43670928,bartosz |🧊,Sun May 31 10:29:26 +0000 2009,"QwQiao, KyleSamani, 0xminion, andyisnotandy, BigBrainKasey, eclecticcapital, firstc0in, geenty, lmrankhan, j0hnwang, 0xMaki, HoolieG, ceterispar1bus, gakonst, Solofunk30, jnwng, zacxbt, AustinBarack, GrantStenger",19
100568224,Dennison,Wed Dec 30 18:50:22 +0000 2009,"QwQiao, KyleSamani, grisacerne, 0xminion, janehk, benlakoff, pet3rpan_, OuroborosCap8, panekkkk, lmrankhan, j0hnwang, sjdedic, 0xMaki, alexgedevani, thetinaverse, MariaShen, zacxbt, kapursanat, 0xbilly",19
722591951950913536,"Tegan.eth 🌅,🦩",Wed Apr 20 01:05:21 +0000 2016,"QwQiao, KyleSamani, Darrenlautf, 0xminion, janehk, Daryllautk, YeouJie, masonnystrom, benlakoff, panekkkk, firstc0in, lmrankhan, j0hnwang, ncerovac, sjrosenblum, alexgedevani, MariaShen, AustinBarack, roybitsir",19
2435251089,Native_0x,Tue Mar 25 09:14:51 +0000 2014,"QwQiao, KyleSamani, Darrenlautf, 0xminion, andyisnotandy, BigBrainKasey, Louissongyz, eclecticcapital, panekkkk, firstc0in, lmrankhan, j0hnwang, 0xMaki, 0xdetweiler, yekiM_o, alexgedevani, roybitsir, tomhschmidt, kapursanat",19
930223743430828032,Set Animals,Mon Nov 13 23:59:57 +0000 2017,"QwQiao, KyleSamani, luffistotle, Darrenlautf, 0xminion, kidponga, janehk, 0xRainandCoffee, panekkkk, j0hnwang, krybharat, ncerovac, 0xMaki, 0xdetweiler, yekiM_o, alexgedevani, MariaShen, zacxbt, 0xbilly",19
43088277,Freddie Farmer,Thu May 28 11:00:42 +0000 2009,"QwQiao, KyleSamani, OmniscientAsian, Darrenlautf, 0xminion, reganbozman, Daryllautk, sandraaleow, geenty, lmrankhan, j0hnwang, 0xMaki, ceterispar1bus, alexgedevani, AustinBarack, roybitsir, delitzer, tomhschmidt, kapursanat",19
540489975,nick,Fri Mar 30 00:55:00 +0000 2012,"QwQiao, KyleSamani, 0xminion, janehk, masonnystrom, benlakoff, caseykcaruso, panekkkk, AliceL991, Shaughnessy119, geenty, lmrankhan, ncerovac, lapgandhi, 0xMaki, alexgedevani, MariaShen, AustinBarack, GrantStenger",19
837854453109665796,Sid Powell 🥞,Sat Mar 04 02:37:23 +0000 2017,"QwQiao, 0xminion, kidponga, ishanee_, janehk, wkhosrowshahi1, andyisnotandy, pet3rpan_, cosmo_jiang, panekkkk, Shaughnessy119, firstc0in, j0hnwang, lapgandhi, Sh_ivam, 0xMaki, zacxbt, AustinBarack, tomhschmidt",19
1154010518790791168,High Stakes Capital,Wed Jul 24 12:48:42 +0000 2019,"QwQiao, OmniscientAsian, Darrenlautf, 0xminion, sandraaleow, YeouJie, cosmo_jiang, OuroborosCap8, geenty, krybharat, 0xdetweiler, 0xChanglu, n4motto, gakonst, alexgedevani, zacxbt, TaikiMaeda2, kapursanat, 0xbilly",19
3239337314,mubaris,Mon Jun 08 01:04:33 +0000 2015,"QwQiao, OmniscientAsian, Darrenlautf, 0xminion, janehk, Daryllautk, 0xRainandCoffee, sandraaleow, geenty, lmrankhan, j0hnwang, 0xMaki, ceterispar1bus, gakonst, alexgedevani, zacxbt, roybitsir, tomhschmidt, 0xbilly",19
1245854688915763200,Jon Kol,Thu Apr 02 23:24:59 +0000 2020,"QwQiao, KyleSamani, luffistotle, 0xWenMoon, 0xminion, janehk, Daryllautk, andyisnotandy, caseykcaruso, bridge__harris, lapgandhi, Sh_ivam, 0xMaki, alexgedevani, AustinBarack, roybitsir, delitzer, tomhschmidt, kapursanat",19
985457400596652032,Tony,Sun Apr 15 09:58:47 +0000 2018,"QwQiao, KyleSamani, Darrenlautf, 0xminion, Daryllautk, sandraaleow, cosmo_jiang, panekkkk, geenty, lmrankhan, j0hnwang, 0xMaki, ceterispar1bus, gakonst, alexgedevani, AustinBarack, tomhschmidt, kapursanat, 0xbilly",19
4805642293,Keeks 𐦂,Sun Jan 24 02:42:06 +0000 2016,"QwQiao, stutireal, Darrenlautf, 0xminion, janehk, Daryllautk, 0xRainandCoffee, eclecticcapital, OuroborosCap8, panekkkk, tkstanczak, geenty, lmrankhan, lapgandhi, 0xMaki, alexgedevani, MariaShen, delitzer, tomhschmidt",19
635682749,Suji Yan - Mask is BUIDLing,Sat Jul 14 21:54:18 +0000 2012,"QwQiao, NTmoney, 0xWenMoon, 0xminion, janehk, reganbozman, benlakoff, pet3rpan_, Louissongyz, panekkkk, lmrankhan, jennyqcheng, 0xMaki, yekiM_o, 0xChanglu, alexgedevani, MariaShen, zacxbt, tomhschmidt, kapursanat",20
786179660350574592,Ryan Todd,Wed Oct 12 12:20:12 +0000 2016,"QwQiao, KyleSamani, Darrenlautf, 0xminion, janehk, Daryllautk, masonnystrom, Mikey0x_, panekkkk, lmrankhan, j0hnwang, 0xMaki, ceterispar1bus, alexgedevani, MariaShen, zacxbt, roybitsir, tomhschmidt, kapursanat",19
846129689399824384,Flo,Sun Mar 26 22:40:13 +0000 2017,"QwQiao, KyleSamani, Darrenlautf, 0xminion, reganbozman, Daryllautk, masonnystrom, amanda0x, j0hnwang, lapgandhi, 0xMaki, ceterispar1bus, Solofunk30, alexgedevani, MariaShen, AustinBarack, delitzer, tomhschmidt, kapursanat",19
1833946076,neil,Sun Sep 08 20:09:56 +0000 2013,"KyleSamani, OmniscientAsian, Darrenlautf, 0xminion, ishanee_, janehk, rishisthinking, YeouJie, BigBrainKasey, Yedidbotton, j0hnwang, CryptoSources, jennyqcheng, lapgandhi, sjrosenblum, ceterispar1bus, n4motto, alexgedevani, tomhschmidt",19
36425256,Happy Norswap 🤠🏴‍☠️✨,Wed Apr 29 17:58:46 +0000 2009,"KyleSamani, grisacerne, 0xminion, Daryllautk, 0xRainandCoffee, sandraaleow, andyisnotandy, pet3rpan_, 0xKofi, Louissongyz, tkstanczak, notnotstorm, j0hnwang, lapgandhi, 0xMaki, samoyedali, n4motto, kapursanat, 0xbilly",19
1427220791951822848,devloper,Mon Aug 16 10:48:53 +0000 2021,"KyleSamani, grisacerne, OmniscientAsian, Darrenlautf, 0xminion, janehk, rishisthinking, Daryllautk, 0xRainandCoffee, bridge__harris, Louissongyz, _weidai, lapgandhi, yekiM_o, samoyedali, caitlinxyz, roybitsir, delitzer, GrantStenger",19
1126018087,tom 🐵,Sun Jan 27 19:36:30 +0000 2013,"KyleSamani, OmniscientAsian, Darrenlautf, 0xminion, janehk, Daryllautk, sandraaleow, YeouJie, j0hnwang, 0xMaki, sjrosenblum, 0xChanglu, gakonst, alexgedevani, jnwng, thetinaverse, AustinBarack, roybitsir, kapursanat",19
1282508255797755904,UXD,Mon Jul 13 02:52:58 +0000 2020,"KyleSamani, OmniscientAsian, 0xminion, kidponga, janehk, lmrankhan, j0hnwang, lapgandhi, Sh_ivam, 0xMaki, samoyedali, NaytheForceBwU, jnwng, MariaShen, zacxbt, roybitsir, GrantStenger, tomhschmidt, kapursanat",19
1307002014921101313,FLAMINGO 🦩,Fri Sep 18 17:02:29 +0000 2020,"KyleSamani, 0xminion, janehk, masonnystrom, andyisnotandy, benlakoff, caseykcaruso, j0hnwang, krybharat, 0xMaki, sjrosenblum, yekiM_o, 0xChanglu, alexgedevani, MariaShen, zacxbt, AustinBarack, roybitsir, 0xbilly",19
314777746,SuperRare John 💎,Fri Jun 10 19:59:44 +0000 2011,"KyleSamani, NTmoney, Darrenlautf, 0xminion, janehk, sandraaleow, masonnystrom, pet3rpan_, OuroborosCap8, panekkkk, j0hnwang, krybharat, cooper_kunz, 0xMaki, yekiM_o, 0xChanglu, zacxbt, tomhschmidt, 0xbilly",19
398148139,Austin,Tue Oct 25 17:01:16 +0000 2011,"KyleSamani, Darrenlautf, 0xminion, ishanee_, janehk, Daryllautk, sandraaleow, YeouJie, andyisnotandy, BigBrainKasey, OuroborosCap8, Shaughnessy119, lmrankhan, j0hnwang, jnwng, MariaShen, AustinBarack, GrantStenger, kapursanat, 0xbilly",20
15253843,Emiliano Bonassi,Fri Jun 27 11:12:53 +0000 2008,"KyleSamani, Darrenlautf, 0xminion, andyisnotandy, benlakoff, 0xKofi, notnotstorm, _weidai, ncerovac, lapgandhi, Sh_ivam, 0xMaki, ceterispar1bus, samoyedali, caitlinxyz, gakonst, roybitsir, delitzer, kapursanat",19
997715301545361408,MattyVerse,Sat May 19 05:47:19 +0000 2018,"KyleSamani, Darrenlautf, 0xminion, janehk, sandraaleow, masonnystrom, andyisnotandy, benlakoff, panekkkk, j0hnwang, krybharat, lapgandhi, Sh_ivam, 0xMaki, 0xChanglu, alexgedevani, MariaShen, zacxbt, AustinBarack, 0xbilly",20
1087282265774669824,Forefront,Mon Jan 21 09:34:27 +0000 2019,"KyleSamani, Darrenlautf, 0xminion, janehk, andyisnotandy, panekkkk, lmrankhan, j0hnwang, ncerovac, lapgandhi, 0xMaki, sjrosenblum, yekiM_o, samoyedali, alexgedevani, MariaShen, zacxbt, roybitsir, tomhschmidt",19
889753804614369281,Nexus Mutual,Tue Jul 25 07:46:52 +0000 2017,"KyleSamani, NTmoney, OmniscientAsian, Darrenlautf, 0xWenMoon, 0xminion, janehk, BigBrainKasey, OuroborosCap8, panekkkk, geenty, j0hnwang, ncerovac, lapgandhi, yekiM_o, MariaShen, zacxbt, AustinBarack, roybitsir, 0xbilly",20
1301830415821549570,Reflexer,Fri Sep 04 10:32:20 +0000 2020,"KyleSamani, grisacerne, 0xminion, janehk, andyisnotandy, bridge__harris, geenty, lmrankhan, notnotstorm, j0hnwang, ncerovac, 0xMaki, yekiM_o, ceterispar1bus, NaytheForceBwU, AustinBarack, roybitsir, kapursanat, 0xbilly",19
1057722135974539264,Instadapp,Wed Oct 31 19:53:03 +0000 2018,"KyleSamani, 0xminion, janehk, andyisnotandy, panekkkk, robbiepetersen_, tkstanczak, j0hnwang, ncerovac, sjdedic, lapgandhi, Sh_ivam, 0xMaki, alexgedevani, MariaShen, zacxbt, roybitsir, GrantStenger, kapursanat, 0xbilly",20
2251130844,kirk,Tue Dec 17 23:51:57 +0000 2013,"KyleSamani, stutireal, 0xWenMoon, 0xminion, Daryllautk, OuroborosCap8, robbiepetersen_, notnotstorm, j0hnwang, cooper_kunz, 0xMaki, ceterispar1bus, samoyedali, MariaShen, AustinBarack, roybitsir, delitzer, GrantStenger, kapursanat",19
1185623864883253250,señor doggo 🏴🏴‍☠️,Sat Oct 19 18:29:13 +0000 2019,"KyleSamani, Darrenlautf, 0xminion, Daryllautk, pet3rpan_, 0xKofi, panekkkk, tkstanczak, lmrankhan, notnotstorm, j0hnwang, ncerovac, CryptoSources, lapgandhi, 0xMaki, alexgedevani, roybitsir, tomhschmidt, 0xbilly",19
43775786,Dave Portnoy,Sun May 31 23:08:06 +0000 2009,"KyleSamani, luffistotle, janehk, reganbozman, YeouJie, Shaughnessy119, lmrankhan, j0hnwang, CryptoSources, RyanKSterling, 0xdetweiler, yekiM_o, 0xChanglu, n4motto, alexgedevani, MariaShen, zacxbt, tomhschmidt, 0xbilly",19
1126269467917348864,Opyn (TESTNET IS LIVE),Wed May 08 23:35:41 +0000 2019,"KyleSamani, OmniscientAsian, Darrenlautf, 0xminion, janehk, Daryllautk, andyisnotandy, robbiepetersen_, tkstanczak, geenty, lmrankhan, j0hnwang, lapgandhi, 0xMaki, MariaShen, zacxbt, AustinBarack, roybitsir, tomhschmidt, 0xbilly",20
5418912,John Collison,Mon Apr 23 02:53:59 +0000 2007,"KyleSamani, Darrenlautf, 0xminion, janehk, rishisthinking, wkhosrowshahi1, SimaoCCruz, panekkkk, lmrankhan, j0hnwang, lapgandhi, Sh_ivam, sjrosenblum, gakonst, jnwng, MariaShen, AustinBarack, delitzer, GrantStenger",19
346706911,brendan.base.eth,Mon Aug 01 18:19:32 +0000 2011,"KyleSamani, NTmoney, 0xminion, janehk, masonnystrom, andyisnotandy, pet3rpan_, 0xKofi, caseykcaruso, panekkkk, lmrankhan, j0hnwang, krybharat, alexgedevani, MariaShen, zacxbt, roybitsir, delitzer, tomhschmidt, 0xbilly",20
605700792,Vlad Tenev,Mon Jun 11 18:03:17 +0000 2012,"KyleSamani, stutireal, 0xminion, ishanee_, bridge__harris, panekkkk, Shaughnessy119, Yedidbotton, lmrankhan, j0hnwang, jonathankingvc, Sh_ivam, 0xMaki, samoyedali, alexgedevani, pokeapallascat, jnwng, MariaShen, GrantStenger",19
396135846,Chjango Unchained🦇🔊,Sat Oct 22 20:10:48 +0000 2011,"KyleSamani, NTmoney, Darrenlautf, janehk, Daryllautk, 0xRainandCoffee, wkhosrowshahi1, YeouJie, OuroborosCap8, Shaughnessy119, lmrankhan, j0hnwang, yekiM_o, samoyedali, gakonst, alexgedevani, MariaShen, zacxbt, AustinBarack",19
923764031583789057,Set Labs ⚖️,Fri Oct 27 04:11:22 +0000 2017,"KyleSamani, OmniscientAsian, 0xminion, janehk, reganbozman, Daryllautk, andyisnotandy, panekkkk, geenty, lmrankhan, j0hnwang, ncerovac, lapgandhi, 0xMaki, yekiM_o, MariaShen, AustinBarack, roybitsir, kapursanat, 0xbilly",20
237624170,Reuben Brama,Thu Jan 13 07:25:45 +0000 2011,"KyleSamani, NTmoney, 0xminion, janehk, reganbozman, Daryllautk, masonnystrom, caseykcaruso, panekkkk, lmrankhan, j0hnwang, 0xMaki, sjrosenblum, alexgedevani, MariaShen, AustinBarack, roybitsir, delitzer, tomhschmidt",19
143053926,Gavin Andresen,Wed May 12 13:17:12 +0000 2010,"KyleSamani, NTmoney, OmniscientAsian, janehk, Daryllautk, benlakoff, SimaoCCruz, panekkkk, geenty, j0hnwang, 0xMaki, sjrosenblum, jnwng, MariaShen, zacxbt, AustinBarack, delitzer, GrantStenger, 0xbilly",19
28917111,Justin Kan,Sun Apr 05 01:55:05 +0000 2009,"KyleSamani, OmniscientAsian, Darrenlautf, janehk, andyisnotandy, benlakoff, SimaoCCruz, panekkkk, j0hnwang, krybharat, ncerovac, jennyqcheng, 0xMaki, 0xChanglu, alexgedevani, pokeapallascat, jnwng, MariaShen, zacxbt",19
1530747804976439296,sudolabel,Sun May 29 03:08:22 +0000 2022,"luffistotle, OmniscientAsian, 0xminion, Mikey0x_, 0xKofi, bridge__harris, firstc0in, notnotstorm, j0hnwang, lapgandhi, 0xMaki, samoyedali, n4motto, caitlinxyz, gakonst, MariaShen, delitzer, GrantStenger, tomhschmidt",19
1231831448509829121,Perpetual Protocol (=ↀωↀ=),Mon Feb 24 06:41:41 +0000 2020,"luffistotle, OmniscientAsian, Darrenlautf, 0xminion, kidponga, janehk, reganbozman, Daryllautk, andyisnotandy, bridge__harris, OuroborosCap8, panekkkk, lmrankhan, j0hnwang, lapgandhi, MariaShen, AustinBarack, roybitsir, tomhschmidt, 0xbilly",20
1204246294887161856,ʟᴏʀᴇ.xʏᴢ,Tue Dec 10 03:47:50 +0000 2019,"grisacerne, 0xminion, reganbozman, andyisnotandy, AliceL991, lmrankhan, j0hnwang, krybharat, lapgandhi, 0xMaki, 0xdetweiler, yekiM_o, samoyedali, alexgedevani, MariaShen, zacxbt, AustinBarack, roybitsir, tomhschmidt",19
919398266826981376,τop τick crypτo 📁 🤖🧠,Sun Oct 15 03:03:23 +0000 2017,"OmniscientAsian, Darrenlautf, 0xminion, kidponga, 0xRainandCoffee, sandraaleow, YeouJie, cosmo_jiang, Shaughnessy119, amanda0x, j0hnwang, krybharat, CryptoSources, 0xdetweiler, ceterispar1bus, alexgedevani, NaytheForceBwU, zacxbt, TaikiMaeda2",19
1611429930272968705,Thanefield Research,Fri Jan 06 18:30:21 +0000 2023,"OmniscientAsian, Darrenlautf, 0xminion, kidponga, sandraaleow, YeouJie, andyisnotandy, Mikey0x_, j0hnwang, krybharat, sjdedic, Sh_ivam, n4motto, alexgedevani, MariaShen, AustinBarack, gregohr12, TaikiMaeda2, GrantStenger",19
2922770266,sto,Mon Dec 15 11:28:35 +0000 2014,"OmniscientAsian, Darrenlautf, 0xWenMoon, 0xminion, kidponga, 0xRainandCoffee, sandraaleow, eclecticcapital, lmrankhan, j0hnwang, krybharat, CryptoSources, 0xMaki, alexgedevani, pokeapallascat, zacxbt, TaikiMaeda2, kapursanat, 0xbilly",19
1402687942380986377,InternDAO,Wed Jun 09 18:04:10 +0000 2021,"OmniscientAsian, Darrenlautf, 0xminion, kidponga, rishisthinking, Daryllautk, sandraaleow, andyisnotandy, OuroborosCap8, lapgandhi, 0xMaki, samoyedali, 0xChanglu, Solofunk30, alexgedevani, NaytheForceBwU, MariaShen, AustinBarack, roybitsir, 0xbilly",20
1182591601593454592,Gelato,Fri Oct 11 09:39:52 +0000 2019,"OmniscientAsian, 0xWenMoon, 0xminion, janehk, andyisnotandy, AliceL991, geenty, j0hnwang, lapgandhi, Sh_ivam, 0xMaki, sjrosenblum, Solofunk30, MariaShen, zacxbt, AustinBarack, roybitsir, delitzer, GrantStenger, 0xbilly",20
1022821051187822593,glassnode,Fri Jul 27 12:28:36 +0000 2018,"OmniscientAsian, 0xminion, janehk, Daryllautk, 0xRainandCoffee, YeouJie, andyisnotandy, cosmo_jiang, OuroborosCap8, notnotstorm, j0hnwang, lapgandhi, Sh_ivam, 0xdetweiler, alexgedevani, pokeapallascat, AustinBarack, GrantStenger, kapursanat",19
995500158417711104,Loma,Sun May 13 03:05:08 +0000 2018,"OmniscientAsian, Darrenlautf, 0xminion, Daryllautk, YeouJie, andyisnotandy, eclecticcapital, OuroborosCap8, lmrankhan, j0hnwang, krybharat, 0xMaki, 0xdetweiler, alexgedevani, zacxbt, TaikiMaeda2, GrantStenger, kapursanat, 0xbilly",19
1326211445978144768,crv.mktcap.eth,Tue Nov 10 17:13:48 +0000 2020,"stutireal, Darrenlautf, 0xWenMoon, 0xminion, kidponga, rishisthinking, Daryllautk, 0xRainandCoffee, andyisnotandy, OuroborosCap8, j0hnwang, krybharat, daedalus_angels, lapgandhi, 0xMaki, alexgedevani, MariaShen, AustinBarack, 0xbilly",19
743521326195838977,zak.eth,Thu Jun 16 19:11:12 +0000 2016,"stutireal, 0xminion, janehk, Daryllautk, benlakoff, pet3rpan_, panekkkk, Shaughnessy119, tkstanczak, j0hnwang, 0xMaki, 0xdetweiler, caitlinxyz, gakonst, MariaShen, zacxbt, roybitsir, delitzer, 0xbilly",19
1377784330966069249,Defined,Fri Apr 02 00:46:13 +0000 2021,"Darrenlautf, 0xminion, janehk, lmrankhan, j0hnwang, CryptoSources, jonathankingvc, lapgandhi, Sh_ivam, 0xMaki, 0xdetweiler, yekiM_o, samoyedali, Solofunk30, alexgedevani, NaytheForceBwU, MariaShen, AustinBarack, roybitsir",19
998179257200164865,degentrading,Sun May 20 12:30:55 +0000 2018,"Darrenlautf, 0xWenMoon, 0xminion, rishisthinking, sandraaleow, YeouJie, andyisnotandy, benlakoff, Shaughnessy119, lmrankhan, notnotstorm, j0hnwang, jonathankingvc, jennyqcheng, lapgandhi, 0xMaki, gakonst, AustinBarack, kapursanat",19
1559193198605774850,2Lambroz 🐑 (🧑‍🍳🥩🤌),Mon Aug 15 15:00:24 +0000 2022,"Darrenlautf, 0xWenMoon, 0xminion, sandraaleow, YeouJie, andyisnotandy, pet3rpan_, eclecticcapital, OuroborosCap8, j0hnwang, CryptoSources, jennyqcheng, lapgandhi, 0xMaki, samoyedali, thetinaverse, zacxbt, roybitsir, gregohr12, GrantStenger",20
905566160044920832,Gammichan,Wed Sep 06 22:59:31 +0000 2017,"Darrenlautf, 0xWenMoon, 0xminion, kidponga, sandraaleow, andyisnotandy, Shaughnessy119, amanda0x, lmrankhan, j0hnwang, krybharat, CryptoSources, jonathankingvc, 0xMaki, ceterispar1bus, Solofunk30, zacxbt, AustinBarack, TaikiMaeda2",19
1353062898419994626,Now Media,Sat Jan 23 19:31:54 +0000 2021,"Darrenlautf, 0xminion, janehk, sandraaleow, YeouJie, andyisnotandy, eclecticcapital, j0hnwang, krybharat, Sh_ivam, 0xMaki, RyanKSterling, yekiM_o, 0xChanglu, Solofunk30, alexgedevani, MariaShen, zacxbt, AustinBarack",19
1428078635861299211,Supdrive,Wed Aug 18 19:37:53 +0000 2021,"Darrenlautf, 0xminion, janehk, Daryllautk, panekkkk, j0hnwang, ncerovac, lapgandhi, 0xMaki, yekiM_o, gakonst, alexgedevani, MariaShen, zacxbt, AustinBarack, roybitsir, delitzer, tomhschmidt, 0xbilly",19
1175650198116347904,Alfa ((+)),Sun Sep 22 05:59:02 +0000 2019,"Darrenlautf, 0xminion, Daryllautk, YeouJie, andyisnotandy, caseykcaruso, OuroborosCap8, j0hnwang, CryptoSources, 0xMaki, 0xdetweiler, yekiM_o, ceterispar1bus, samoyedali, n4motto, alexgedevani, delitzer, GrantStenger, 0xbilly",19
1365737566373371906,Gamma,Sat Feb 27 18:56:45 +0000 2021,"Darrenlautf, 0xWenMoon, 0xminion, janehk, Daryllautk, wkhosrowshahi1, andyisnotandy, OuroborosCap8, panekkkk, geenty, j0hnwang, ncerovac, CryptoSources, 0xMaki, yekiM_o, MariaShen, zacxbt, AustinBarack, GrantStenger",19
1305761409364447232,NFTX 🦧🕳,Tue Sep 15 06:53:05 +0000 2020,"Darrenlautf, 0xminion, janehk, reganbozman, sandraaleow, andyisnotandy, bridge__harris, panekkkk, tkstanczak, j0hnwang, krybharat, ncerovac, jennyqcheng, 0xMaki, samoyedali, MariaShen, zacxbt, roybitsir, 0xbilly",19
950915985422221312,PeckShield Inc.,Wed Jan 10 02:23:32 +0000 2018,"Darrenlautf, 0xminion, janehk, Daryllautk, andyisnotandy, benlakoff, bridge__harris, OuroborosCap8, panekkkk, j0hnwang, CryptoSources, jennyqcheng, 0xMaki, 0xdetweiler, MariaShen, zacxbt, roybitsir, tomhschmidt, 0xbilly",19
2728570895,SYMMIO,Tue Jul 29 22:44:13 +0000 2014,"Darrenlautf, 0xWenMoon, 0xminion, Daryllautk, sandraaleow, wkhosrowshahi1, andyisnotandy, SimaoCCruz, eclecticcapital, geenty, j0hnwang, krybharat, 0xMaki, MariaShen, zacxbt, AustinBarack, roybitsir, tomhschmidt, kapursanat, 0xbilly",20
1001654384743387137,Fozzy,Wed May 30 02:39:49 +0000 2018,"0xWenMoon, 0xminion, kidponga, Daryllautk, sandraaleow, wkhosrowshahi1, masonnystrom, cosmo_jiang, OuroborosCap8, geenty, lmrankhan, j0hnwang, 0xMaki, 0xdetweiler, gakonst, AustinBarack, TaikiMaeda2, GrantStenger, kapursanat",19
2260491445,CoinMarketCap,Tue Dec 24 16:50:12 +0000 2013,"0xWenMoon, janehk, reganbozman, andyisnotandy, panekkkk, tkstanczak, geenty, notnotstorm, j0hnwang, sjdedic, jonathankingvc, lapgandhi, Sh_ivam, 0xChanglu, pokeapallascat, MariaShen, AustinBarack, gregohr12, 0xbilly",19
1464037386820538368,+7 🐰,Fri Nov 26 01:04:54 +0000 2021,"0xminion, masonnystrom, Mikey0x_, Louissongyz, eclecticcapital, lmrankhan, j0hnwang, lapgandhi, HoolieG, 0xdetweiler, yekiM_o, samoyedali, 0xChanglu, caitlinxyz, alexgedevani, MariaShen, zacxbt, roybitsir, kapursanat",19
