id,name,register_date,followed_by,followers_count,link
1182591601593454592,Gelato,Fri Oct 11 09:39:52 +0000 2019,"OmniscientAsian, 0xWenMoon, 0xminion, janehk, andyisnotandy, AliceL991, geenty, j0hnwang, Sh_ivam, 0xMaki, sjrosenblum, Solofunk30, MariaShen, zacxbt, AustinBarack, roybitsir, delitzer, GrantStenger, 0xbilly",19,https://x.com/i/user/1182591601593454592
322684937,yitong,Thu Jun 23 15:43:07 +0000 2011,"OmniscientAsian, ishanee_, janehk, Daryllautk, andyisnotandy, pet3rpan_, j0hnwang, op7418, jonathankingvc, 0xMaki, HoolieG, sjrosenblum, MariaShen, zacxbt, roybitsir, TaikiMaeda2, delitzer, GrantStenger, tomhschmidt, kapursanat",20,https://x.com/i/user/322684937
331819692,Daniel Hwang 💚,Fri Jul 08 19:26:04 +0000 2011,"OmniscientAsian, 0xWenMoon, 0xminion, kidponga, Daryllautk, wkhosrowshahi1, YeouJie, masonnystrom, pet3rpan_, cosmo_jiang, panekkkk, j0hnwang, 0xMaki, yekiM_o, samoyedali, 0xChanglu, gakonst, zacxbt, roybitsir, tomhschmidt",20,https://x.com/i/user/331819692
872240096568721408,Rocket Pool,Tue Jun 06 23:53:39 +0000 2017,"OmniscientAsian, 0xWenMoon, 0xminion, janehk, sandraaleow, wkhosrowshahi1, tkstanczak, j0hnwang, jonathankingvc, Sh_ivam, 0xMaki, HoolieG, yekiM_o, ceterispar1bus, MariaShen, mattyryze, AustinBarack, GrantStenger, 0xbilly",19,https://x.com/i/user/872240096568721408
995500158417711104,Loma,Sun May 13 03:05:08 +0000 2018,"OmniscientAsian, Darrenlautf, 0xminion, Daryllautk, YeouJie, andyisnotandy, eclecticcapital, OuroborosCap8, lmrankhan, j0hnwang, krybharat, 0xMaki, 0xdetweiler, alexgedevani, zacxbt, TaikiMaeda2, GrantStenger, kapursanat, 0xbilly",19,https://x.com/i/user/995500158417711104
1367788919551590400,anon,Fri Mar 05 10:47:55 +0000 2021,"stutireal, Darrenlautf, 0xWenMoon, 0xminion, Daryllautk, sandraaleow, Mikey0x_, pet3rpan_, lmrankhan, j0hnwang, 0xMaki, ceterispar1bus, samoyedali, gakonst, alexgedevani, NaytheForceBwU, thetinaverse, mattyryze, kapursanat",19,https://x.com/i/user/1367788919551590400
1318918091116523521,winny,Wed Oct 21 14:12:37 +0000 2020,"stutireal, Darrenlautf, janehk, Daryllautk, andyisnotandy, pet3rpan_, bridge__harris, eclecticcapital, ncerovac, cooper_kunz, sjdedic, 0xMaki, 0xdetweiler, samoyedali, alexgedevani, jnwng, thetinaverse, MariaShen, mattyryze, zacxbt, 0xbilly",21,https://x.com/i/user/1318918091116523521
743521326195838977,zak.eth,Thu Jun 16 19:11:12 +0000 2016,"stutireal, 0xminion, janehk, Daryllautk, benlakoff, pet3rpan_, panekkkk, tkstanczak, j0hnwang, 0xMaki, 0xdetweiler, caitlinxyz, gakonst, MariaShen, zacxbt, roybitsir, delitzer, tomhschmidt, 0xbilly",19,https://x.com/i/user/743521326195838977
1307891177572782080,mephisto,Mon Sep 21 03:55:37 +0000 2020,"stutireal, 0xminion, janehk, rishisthinking, Daryllautk, sandraaleow, benlakoff, caseykcaruso, Shaughnessy119, amanda0x, CryptoSources, jonathankingvc, Sh_ivam, ceterispar1bus, samoyedali, gakonst, mattyryze, AustinBarack, GrantStenger, tomhschmidt",20,https://x.com/i/user/1307891177572782080
44205398,Sébastien Derivaux,Tue Jun 02 20:53:16 +0000 2009,"stutireal, 0xminion, kidponga, andyisnotandy, Mikey0x_, panekkkk, robbiepetersen_, geenty, notnotstorm, j0hnwang, Sh_ivam, 0xMaki, ceterispar1bus, gakonst, MariaShen, mattyryze, TaikiMaeda2, tomhschmidt, kapursanat",19,https://x.com/i/user/44205398
3181970364,𝚂𝚌𝚘𝚝𝚝 𝙼𝚘𝚘𝚛𝚎 🌐,Fri May 01 17:52:06 +0000 2015,"stutireal, 0xminion, ishanee_, janehk, reganbozman, Daryllautk, benlakoff, pet3rpan_, bridge__harris, panekkkk, lmrankhan, j0hnwang, ncerovac, 0xMaki, MariaShen, zacxbt, roybitsir, delitzer, GrantStenger, tomhschmidt, 0xbilly",21,https://x.com/i/user/3181970364
180115578,Mira Murati,Wed Aug 18 21:43:38 +0000 2010,"stutireal, kidponga, janehk, rishisthinking, sandraaleow, caseykcaruso, bridge__harris, eclecticcapital, panekkkk, Shaughnessy119, j0hnwang, op7418, ncerovac, sjrosenblum, gakonst, jnwng, MariaShen, mattyryze, zacxbt, GrantStenger",20,https://x.com/i/user/180115578
1266652889197371393,0xBeans,Sat May 30 08:49:23 +0000 2020,"stutireal, Darrenlautf, 0xminion, janehk, Daryllautk, 0xRainandCoffee, wkhosrowshahi1, masonnystrom, pet3rpan_, geenty, j0hnwang, jonathankingvc, 0xMaki, caitlinxyz, gakonst, alexgedevani, MariaShen, mattyryze, zacxbt, delitzer, GrantStenger, kapursanat",22,https://x.com/i/user/1266652889197371393
1542042946161512448,DWF Labs,Wed Jun 29 07:12:37 +0000 2022,"Darrenlautf, 0xWenMoon, 0xminion, kidponga, andyisnotandy, j0hnwang, krybharat, AjeetK, sjdedic, jennyqcheng, Sh_ivam, samoyedali, 0xChanglu, Solofunk30, pokeapallascat, mattyryze, zacxbt, GrantStenger, kapursanat",19,https://x.com/i/user/1542042946161512448
1377784330966069249,Defined,Fri Apr 02 00:46:13 +0000 2021,"Darrenlautf, 0xminion, janehk, lmrankhan, j0hnwang, CryptoSources, jonathankingvc, Sh_ivam, 0xMaki, 0xdetweiler, yekiM_o, samoyedali, Solofunk30, alexgedevani, NaytheForceBwU, MariaShen, mattyryze, AustinBarack, roybitsir",19,https://x.com/i/user/1377784330966069249
1747737231916240896,Creator.Bid 🕵️🗝️,Wed Jan 17 21:47:06 +0000 2024,"Darrenlautf, 0xminion, sandraaleow, benlakoff, Shaughnessy119, j0hnwang, krybharat, CryptoSources, sjdedic, jonathankingvc, Sh_ivam, RyanKSterling, yekiM_o, 0xChanglu, alexgedevani, mattyryze, zacxbt, roybitsir, gregohr12",19,https://x.com/i/user/1747737231916240896
981035585933627392,Molecule,Tue Apr 03 05:08:05 +0000 2018,"Darrenlautf, 0xminion, janehk, pet3rpan_, caseykcaruso, Louissongyz, eclecticcapital, panekkkk, geenty, sjdedic, 0xMaki, 0xdetweiler, yekiM_o, samoyedali, jnwng, thetinaverse, zacxbt, AustinBarack, 0xbilly",19,https://x.com/i/user/981035585933627392
1833183120126095360,Pump Science,Mon Sep 09 16:38:22 +0000 2024,"Darrenlautf, 0xminion, Daryllautk, benlakoff, lmrankhan, krybharat, sjdedic, jennyqcheng, Sh_ivam, 0xMaki, HoolieG, ceterispar1bus, samoyedali, jnwng, mattyryze, zacxbt, AustinBarack, roybitsir, 0xbilly",19,https://x.com/i/user/1833183120126095360
1559193198605774850,2Lambroz 🐑 (🧑‍🍳🥩🤌),Mon Aug 15 15:00:24 +0000 2022,"Darrenlautf, 0xWenMoon, 0xminion, sandraaleow, YeouJie, andyisnotandy, pet3rpan_, eclecticcapital, OuroborosCap8, j0hnwang, CryptoSources, jennyqcheng, 0xMaki, samoyedali, thetinaverse, zacxbt, roybitsir, gregohr12, GrantStenger",19,https://x.com/i/user/1559193198605774850
1483660647858638851,JokeRace,Wed Jan 19 04:41:11 +0000 2022,"Darrenlautf, 0xminion, janehk, 0xRainandCoffee, andyisnotandy, pet3rpan_, j0hnwang, ncerovac, Sh_ivam, HoolieG, samoyedali, 0xChanglu, alexgedevani, NaytheForceBwU, thetinaverse, MariaShen, mattyryze, zacxbt, 0xbilly",19,https://x.com/i/user/1483660647858638851
1087774171,Bobby Thakkar,Mon Jan 14 02:14:13 +0000 2013,"Darrenlautf, rishisthinking, Daryllautk, sandraaleow, andyisnotandy, benlakoff, caseykcaruso, amanda0x, lmrankhan, j0hnwang, jonathankingvc, 0xMaki, RyanKSterling, sjrosenblum, samoyedali, caitlinxyz, jnwng, mattyryze, roybitsir, GrantStenger",20,https://x.com/i/user/1087774171
1347335187823292416,Res,Fri Jan 08 00:12:08 +0000 2021,"Darrenlautf, 0xminion, Daryllautk, sandraaleow, andyisnotandy, benlakoff, OuroborosCap8, robbiepetersen_, j0hnwang, krybharat, CryptoSources, sjdedic, Sh_ivam, 0xMaki, 0xdetweiler, zacxbt, AustinBarack, roybitsir, TaikiMaeda2, GrantStenger, 0xbilly",21,https://x.com/i/user/1347335187823292416
988856471986364416,Belinda,Tue Apr 24 19:05:29 +0000 2018,"Darrenlautf, 0xWenMoon, 0xminion, rishisthinking, reganbozman, 0xRainandCoffee, sandraaleow, YeouJie, Mikey0x_, j0hnwang, CryptoSources, sjdedic, jennyqcheng, 0xMaki, thetinaverse, mattyryze, gregohr12, TaikiMaeda2, GrantStenger",19,https://x.com/i/user/988856471986364416
1422255111422754816,buildspace,Mon Aug 02 17:57:08 +0000 2021,"Darrenlautf, 0xminion, kidponga, janehk, rishisthinking, Daryllautk, benlakoff, caseykcaruso, eclecticcapital, OuroborosCap8, geenty, j0hnwang, ncerovac, 0xMaki, HoolieG, samoyedali, alexgedevani, jnwng, mattyryze, roybitsir",20,https://x.com/i/user/1422255111422754816
1354947293921701892,artsch00lreject,Fri Jan 29 00:19:52 +0000 2021,"Darrenlautf, 0xminion, 0xRainandCoffee, sandraaleow, bridge__harris, amanda0x, lmrankhan, j0hnwang, krybharat, CryptoSources, samoyedali, 0xChanglu, Solofunk30, alexgedevani, NaytheForceBwU, mattyryze, zacxbt, GrantStenger, kapursanat",19,https://x.com/i/user/1354947293921701892
1327336243026223104,♡ Charlotte Fang 🪲 Crown Prince ❀ LOVE HEALS 💞,Fri Nov 13 19:43:31 +0000 2020,"Darrenlautf, 0xWenMoon, kidponga, 0xRainandCoffee, pet3rpan_, firstc0in, lmrankhan, krybharat, CryptoSources, 0xMaki, samoyedali, 0xChanglu, caitlinxyz, MariaShen, mattyryze, zacxbt, GrantStenger, tomhschmidt, kapursanat",19,https://x.com/i/user/1327336243026223104
1450805517186519044,Jack,Wed Oct 20 12:46:18 +0000 2021,"Darrenlautf, 0xminion, janehk, pet3rpan_, OuroborosCap8, amanda0x, lmrankhan, j0hnwang, krybharat, Sh_ivam, 0xMaki, HoolieG, 0xChanglu, alexgedevani, jnwng, thetinaverse, MariaShen, mattyryze, zacxbt",19,https://x.com/i/user/1450805517186519044
1444894134758567941,Ivy Deng,Mon Oct 04 05:16:32 +0000 2021,"Darrenlautf, 0xWenMoon, 0xminion, rishisthinking, Daryllautk, 0xRainandCoffee, sandraaleow, eclecticcapital, OuroborosCap8, firstc0in, j0hnwang, CryptoSources, 0xMaki, samoyedali, caitlinxyz, thetinaverse, mattyryze, tomhschmidt, kapursanat",19,https://x.com/i/user/1444894134758567941
1462201664924909570,alli,Sat Nov 20 23:30:27 +0000 2021,"Darrenlautf, 0xminion, janehk, Daryllautk, sandraaleow, masonnystrom, caseykcaruso, bridge__harris, eclecticcapital, panekkkk, j0hnwang, cooper_kunz, sjdedic, sjrosenblum, caitlinxyz, gakonst, alexgedevani, MariaShen, mattyryze, roybitsir",20,https://x.com/i/user/1462201664924909570
4823533990,Mene Mazarakis,Mon Jan 18 09:03:42 +0000 2016,"Darrenlautf, 0xminion, janehk, rishisthinking, Daryllautk, masonnystrom, benlakoff, pet3rpan_, caseykcaruso, bridge__harris, Shaughnessy119, j0hnwang, 0xMaki, 0xChanglu, gakonst, alexgedevani, MariaShen, mattyryze, AustinBarack, roybitsir, GrantStenger, tomhschmidt",22,https://x.com/i/user/4823533990
905566160044920832,Gammichan,Wed Sep 06 22:59:31 +0000 2017,"Darrenlautf, 0xWenMoon, 0xminion, kidponga, sandraaleow, andyisnotandy, Shaughnessy119, amanda0x, lmrankhan, j0hnwang, krybharat, CryptoSources, jonathankingvc, 0xMaki, ceterispar1bus, Solofunk30, zacxbt, AustinBarack, TaikiMaeda2",19,https://x.com/i/user/905566160044920832
1265838566531379200,Onchain Wizard,Thu May 28 02:53:37 +0000 2020,"Darrenlautf, 0xminion, kidponga, reganbozman, Daryllautk, 0xRainandCoffee, sandraaleow, andyisnotandy, BigBrainKasey, OuroborosCap8, geenty, j0hnwang, CryptoSources, 0xMaki, alexgedevani, pokeapallascat, mattyryze, AustinBarack, kapursanat",19,https://x.com/i/user/1265838566531379200
465173917,Zach,Mon Jan 16 01:55:21 +0000 2012,"Darrenlautf, janehk, benlakoff, Mikey0x_, pet3rpan_, panekkkk, Shaughnessy119, lmrankhan, j0hnwang, 0xMaki, HoolieG, sjrosenblum, 0xdetweiler, yekiM_o, 0xChanglu, alexgedevani, MariaShen, mattyryze, roybitsir, GrantStenger",20,https://x.com/i/user/465173917
1661136128,alz,Sat Aug 10 22:58:48 +0000 2013,"Darrenlautf, 0xminion, ishanee_, Daryllautk, 0xRainandCoffee, sandraaleow, YeouJie, andyisnotandy, panekkkk, tkstanczak, Yedidbotton, lmrankhan, notnotstorm, j0hnwang, gakonst, MariaShen, roybitsir, GrantStenger, tomhschmidt, kapursanat, 0xbilly",21,https://x.com/i/user/1661136128
1483490828848799748,Bain Capital Crypto,Tue Jan 18 17:26:09 +0000 2022,"Darrenlautf, 0xminion, kidponga, rishisthinking, reganbozman, 0xRainandCoffee, andyisnotandy, eclecticcapital, j0hnwang, _weidai, ncerovac, sjdedic, Sh_ivam, 0xdetweiler, samoyedali, NaytheForceBwU, MariaShen, mattyryze, roybitsir",19,https://x.com/i/user/1483490828848799748
19032289,Nat Eliason,Thu Jan 15 18:28:47 +0000 2009,"Darrenlautf, 0xminion, ishanee_, janehk, Daryllautk, sandraaleow, andyisnotandy, benlakoff, SimaoCCruz, amanda0x, j0hnwang, 0xMaki, samoyedali, 0xChanglu, jnwng, MariaShen, mattyryze, tomhschmidt, 0xbilly",19,https://x.com/i/user/19032289
1421343920542257163,13yr old with a credit card,Sat Jul 31 05:36:40 +0000 2021,"Darrenlautf, 0xminion, Daryllautk, 0xRainandCoffee, sandraaleow, andyisnotandy, OuroborosCap8, amanda0x, j0hnwang, CryptoSources, 0xMaki, ceterispar1bus, 0xChanglu, alexgedevani, MariaShen, AustinBarack, roybitsir, delitzer, tomhschmidt, kapursanat",20,https://x.com/i/user/1421343920542257163
1438226914309812226,Sismo,Wed Sep 15 19:43:37 +0000 2021,"Darrenlautf, 0xminion, janehk, reganbozman, benlakoff, AliceL991, lmrankhan, j0hnwang, ncerovac, cooper_kunz, 0xMaki, sjrosenblum, samoyedali, alexgedevani, MariaShen, mattyryze, roybitsir, tomhschmidt, 0xbilly",19,https://x.com/i/user/1438226914309812226
987899418597879808,Brian Fakhoury,Sun Apr 22 03:42:30 +0000 2018,"Darrenlautf, janehk, Daryllautk, YeouJie, masonnystrom, andyisnotandy, benlakoff, Mikey0x_, OuroborosCap8, firstc0in, j0hnwang, krybharat, CryptoSources, sjdedic, alexgedevani, MariaShen, roybitsir, GrantStenger, kapursanat",19,https://x.com/i/user/987899418597879808
1168574919204048902,Big D,Mon Sep 02 17:22:34 +0000 2019,"Darrenlautf, 0xWenMoon, 0xminion, kidponga, Daryllautk, 0xRainandCoffee, sandraaleow, benlakoff, j0hnwang, 0xMaki, 0xdetweiler, samoyedali, alexgedevani, mattyryze, zacxbt, AustinBarack, roybitsir, tomhschmidt, kapursanat",19,https://x.com/i/user/1168574919204048902
1412847182236073988,Beam Foundation,Wed Jul 07 18:54:42 +0000 2021,"Darrenlautf, 0xminion, kidponga, janehk, andyisnotandy, cosmo_jiang, geenty, j0hnwang, krybharat, ncerovac, daedalus_angels, 0xMaki, samoyedali, 0xChanglu, MariaShen, mattyryze, zacxbt, roybitsir, gregohr12",19,https://x.com/i/user/1412847182236073988
1308468225223593985,Treeverse,Tue Sep 22 18:09:12 +0000 2020,"Darrenlautf, 0xminion, kidponga, OuroborosCap8, panekkkk, j0hnwang, krybharat, ncerovac, Sh_ivam, 0xMaki, 0xdetweiler, yekiM_o, samoyedali, 0xChanglu, alexgedevani, NaytheForceBwU, MariaShen, mattyryze, roybitsir, gregohr12, GrantStenger, 0xbilly",22,https://x.com/i/user/1308468225223593985
4911583324,Andrew,Mon Feb 15 02:53:54 +0000 2016,"Darrenlautf, 0xWenMoon, 0xminion, Daryllautk, sandraaleow, andyisnotandy, benlakoff, Mikey0x_, pet3rpan_, OuroborosCap8, j0hnwang, krybharat, RyanKSterling, 0xChanglu, alexgedevani, jnwng, MariaShen, mattyryze, AustinBarack",19,https://x.com/i/user/4911583324
1353062898419994626,Now Media,Sat Jan 23 19:31:54 +0000 2021,"Darrenlautf, 0xminion, janehk, sandraaleow, YeouJie, andyisnotandy, eclecticcapital, j0hnwang, krybharat, Sh_ivam, 0xMaki, RyanKSterling, yekiM_o, 0xChanglu, Solofunk30, alexgedevani, MariaShen, mattyryze, zacxbt, AustinBarack",20,https://x.com/i/user/1353062898419994626
1352341846698020865,HopProtocol,Thu Jan 21 19:52:03 +0000 2021,"Darrenlautf, 0xWenMoon, 0xminion, janehk, Daryllautk, sandraaleow, wkhosrowshahi1, geenty, notnotstorm, j0hnwang, ncerovac, Sh_ivam, 0xMaki, yekiM_o, MariaShen, mattyryze, AustinBarack, roybitsir, tomhschmidt, 0xbilly",20,https://x.com/i/user/1352341846698020865
1175650198116347904,Alfa ((+)),Sun Sep 22 05:59:02 +0000 2019,"Darrenlautf, 0xminion, Daryllautk, YeouJie, andyisnotandy, caseykcaruso, OuroborosCap8, j0hnwang, CryptoSources, 0xMaki, 0xdetweiler, yekiM_o, ceterispar1bus, samoyedali, alexgedevani, mattyryze, delitzer, GrantStenger, 0xbilly",19,https://x.com/i/user/1175650198116347904
1365737566373371906,Gamma,Sat Feb 27 18:56:45 +0000 2021,"Darrenlautf, 0xWenMoon, 0xminion, janehk, Daryllautk, wkhosrowshahi1, OuroborosCap8, panekkkk, geenty, j0hnwang, ncerovac, CryptoSources, 0xMaki, yekiM_o, MariaShen, mattyryze, zacxbt, AustinBarack, GrantStenger",19,https://x.com/i/user/1365737566373371906
1279207125701390337,Goldfinch,Sat Jul 04 00:16:25 +0000 2020,"Darrenlautf, 0xminion, janehk, wkhosrowshahi1, andyisnotandy, SimaoCCruz, OuroborosCap8, panekkkk, j0hnwang, krybharat, Sh_ivam, ceterispar1bus, samoyedali, MariaShen, mattyryze, zacxbt, AustinBarack, roybitsir, GrantStenger, 0xbilly",20,https://x.com/i/user/1279207125701390337
1305761409364447232,NFTX 🦧🕳,Tue Sep 15 06:53:05 +0000 2020,"Darrenlautf, 0xminion, janehk, reganbozman, sandraaleow, andyisnotandy, bridge__harris, panekkkk, tkstanczak, j0hnwang, krybharat, ncerovac, jennyqcheng, 0xMaki, samoyedali, MariaShen, mattyryze, zacxbt, roybitsir, 0xbilly",20,https://x.com/i/user/1305761409364447232
1012021170244161536,THORChain,Wed Jun 27 17:13:44 +0000 2018,"Darrenlautf, 0xminion, kidponga, Daryllautk, wkhosrowshahi1, andyisnotandy, BigBrainKasey, OuroborosCap8, Shaughnessy119, tkstanczak, geenty, j0hnwang, krybharat, 0xMaki, ceterispar1bus, alexgedevani, MariaShen, AustinBarack, roybitsir, 0xbilly",20,https://x.com/i/user/1012021170244161536
832429980508364800,Garlam,Fri Feb 17 03:22:27 +0000 2017,"Darrenlautf, 0xminion, kidponga, rishisthinking, 0xRainandCoffee, sandraaleow, YeouJie, andyisnotandy, benlakoff, Louissongyz, OuroborosCap8, firstc0in, j0hnwang, CryptoSources, sjdedic, Sh_ivam, 0xMaki, samoyedali, 0xChanglu, roybitsir",20,https://x.com/i/user/832429980508364800
1022028994772910086,Terra 🌍 Powered by LUNA 🌕,Wed Jul 25 08:01:15 +0000 2018,"Darrenlautf, 0xminion, kidponga, janehk, reganbozman, wkhosrowshahi1, andyisnotandy, BigBrainKasey, eclecticcapital, panekkkk, geenty, lmrankhan, notnotstorm, j0hnwang, ncerovac, MariaShen, AustinBarack, roybitsir, 0xbilly",19,https://x.com/i/user/1022028994772910086
312681953,Sahil Bloom,Tue Jun 07 14:14:17 +0000 2011,"Darrenlautf, kidponga, sandraaleow, andyisnotandy, benlakoff, AliceL991, robbiepetersen_, Shaughnessy119, amanda0x, lmrankhan, j0hnwang, krybharat, Sh_ivam, 0xChanglu, Solofunk30, alexgedevani, jnwng, MariaShen, mattyryze, tomhschmidt, 0xbilly",21,https://x.com/i/user/312681953
2545086098,RookieXBT 🧲,Wed Jun 04 02:55:21 +0000 2014,"Darrenlautf, 0xminion, kidponga, sandraaleow, YeouJie, andyisnotandy, benlakoff, OuroborosCap8, Shaughnessy119, krybharat, 0xMaki, 0xdetweiler, caitlinxyz, alexgedevani, MariaShen, mattyryze, zacxbt, GrantStenger, 0xbilly",19,https://x.com/i/user/2545086098
2728570895,SYMMIO,Tue Jul 29 22:44:13 +0000 2014,"Darrenlautf, 0xWenMoon, 0xminion, Daryllautk, sandraaleow, wkhosrowshahi1, SimaoCCruz, eclecticcapital, geenty, j0hnwang, krybharat, 0xMaki, MariaShen, mattyryze, zacxbt, AustinBarack, roybitsir, tomhschmidt, kapursanat, 0xbilly",20,https://x.com/i/user/2728570895
14739890,worthalter 🦇🔊,Mon May 12 03:21:24 +0000 2008,"Darrenlautf, 0xminion, janehk, Daryllautk, wkhosrowshahi1, benlakoff, panekkkk, tkstanczak, j0hnwang, krybharat, ncerovac, 0xMaki, yekiM_o, gakonst, Solofunk30, alexgedevani, MariaShen, mattyryze, zacxbt, tomhschmidt, 0xbilly",21,https://x.com/i/user/14739890
1139174563802226688,🉐 Crypto Linn,Thu Jun 13 14:15:55 +0000 2019,"0xWenMoon, 0xminion, Daryllautk, sandraaleow, YeouJie, andyisnotandy, eclecticcapital, OuroborosCap8, geenty, j0hnwang, CryptoSources, sjdedic, 0xdetweiler, samoyedali, zacxbt, AustinBarack, gregohr12, TaikiMaeda2, GrantStenger",19,https://x.com/i/user/1139174563802226688
1392168200616529927,ambient,Tue May 11 17:22:23 +0000 2021,"0xWenMoon, 0xminion, kidponga, janehk, 0xRainandCoffee, sandraaleow, BigBrainKasey, robbiepetersen_, firstc0in, geenty, notnotstorm, j0hnwang, Sh_ivam, 0xMaki, ceterispar1bus, samoyedali, mattyryze, AustinBarack, roybitsir, delitzer, GrantStenger",21,https://x.com/i/user/1392168200616529927
1395754141348028416,SOCKET,Fri May 21 14:51:51 +0000 2021,"0xWenMoon, 0xminion, kidponga, 0xRainandCoffee, andyisnotandy, Louissongyz, j0hnwang, jonathankingvc, Sh_ivam, 0xMaki, samoyedali, Solofunk30, alexgedevani, mattyryze, zacxbt, AustinBarack, roybitsir, delitzer, GrantStenger",19,https://x.com/i/user/1395754141348028416
1001654384743387137,Fozzy,Wed May 30 02:39:49 +0000 2018,"0xWenMoon, 0xminion, kidponga, Daryllautk, sandraaleow, wkhosrowshahi1, masonnystrom, cosmo_jiang, OuroborosCap8, geenty, lmrankhan, j0hnwang, 0xMaki, 0xdetweiler, gakonst, mattyryze, AustinBarack, TaikiMaeda2, GrantStenger, kapursanat",20,https://x.com/i/user/1001654384743387137
1461399406620688390,Vertex 🏔,Thu Nov 18 18:22:42 +0000 2021,"0xWenMoon, 0xminion, sandraaleow, andyisnotandy, BigBrainKasey, robbiepetersen_, geenty, lmrankhan, j0hnwang, CryptoSources, Sh_ivam, 0xMaki, 0xdetweiler, thetinaverse, MariaShen, mattyryze, AustinBarack, roybitsir, GrantStenger",19,https://x.com/i/user/1461399406620688390
1504185345860022274,Panoptic,Wed Mar 16 20:00:01 +0000 2022,"0xWenMoon, 0xminion, Daryllautk, 0xRainandCoffee, sandraaleow, wkhosrowshahi1, BigBrainKasey, robbiepetersen_, geenty, krybharat, Sh_ivam, 0xMaki, yekiM_o, ceterispar1bus, samoyedali, pokeapallascat, MariaShen, zacxbt, AustinBarack, roybitsir, GrantStenger",21,https://x.com/i/user/1504185345860022274
137548513,GEE-yohm LAMB-bear,Tue Apr 27 02:14:22 +0000 2010,"0xWenMoon, 0xminion, Daryllautk, wkhosrowshahi1, benlakoff, Mikey0x_, eclecticcapital, tkstanczak, geenty, j0hnwang, 0xMaki, samoyedali, alexgedevani, mattyryze, zacxbt, roybitsir, GrantStenger, tomhschmidt, kapursanat",19,https://x.com/i/user/137548513
1506600408193638405,nftperp.xyz,Wed Mar 23 11:55:21 +0000 2022,"0xminion, reganbozman, 0xRainandCoffee, sandraaleow, benlakoff, j0hnwang, krybharat, ncerovac, CryptoSources, Sh_ivam, 0xMaki, yekiM_o, samoyedali, alexgedevani, MariaShen, mattyryze, zacxbt, AustinBarack, roybitsir, GrantStenger",20,https://x.com/i/user/1506600408193638405
1651199844365766656,SendAI,Wed Apr 26 12:21:50 +0000 2023,"0xminion, janehk, rishisthinking, Daryllautk, sandraaleow, AliceL991, Shaughnessy119, amanda0x, jonathankingvc, Sh_ivam, 0xdetweiler, 0xChanglu, Solofunk30, alexgedevani, NaytheForceBwU, mattyryze, zacxbt, AustinBarack, roybitsir",19,https://x.com/i/user/1651199844365766656
82791241,rxbt 👾,Fri Oct 16 03:51:10 +0000 2009,"0xminion, Daryllautk, YeouJie, Shaughnessy119, amanda0x, lmrankhan, j0hnwang, krybharat, ncerovac, jonathankingvc, Sh_ivam, 0xMaki, 0xChanglu, alexgedevani, MariaShen, mattyryze, zacxbt, AustinBarack, GrantStenger",19,https://x.com/i/user/82791241
1753240569692684288,Pandora,Fri Feb 02 02:15:04 +0000 2024,"0xminion, kidponga, sandraaleow, lmrankhan, j0hnwang, krybharat, ncerovac, jennyqcheng, Sh_ivam, 0xMaki, 0xdetweiler, yekiM_o, ceterispar1bus, 0xChanglu, alexgedevani, NaytheForceBwU, MariaShen, mattyryze, AustinBarack",19,https://x.com/i/user/1753240569692684288
962427286506045440,Jonah 🎮,Sat Feb 10 20:45:20 +0000 2018,"0xminion, wkhosrowshahi1, andyisnotandy, benlakoff, pet3rpan_, caseykcaruso, eclecticcapital, lmrankhan, j0hnwang, krybharat, ncerovac, RyanKSterling, samoyedali, 0xChanglu, alexgedevani, mattyryze, zacxbt, gregohr12, GrantStenger",19,https://x.com/i/user/962427286506045440
1552369010142072832,Sovereign,Wed Jul 27 19:04:04 +0000 2022,"0xminion, kidponga, janehk, 0xRainandCoffee, andyisnotandy, BigBrainKasey, bridge__harris, Louissongyz, panekkkk, j0hnwang, Sh_ivam, sjrosenblum, ceterispar1bus, Solofunk30, NaytheForceBwU, mattyryze, roybitsir, delitzer, GrantStenger",19,https://x.com/i/user/1552369010142072832
1494856957471113219,Othersidemeta,Sat Feb 19 02:11:21 +0000 2022,"0xminion, janehk, YeouJie, andyisnotandy, cosmo_jiang, OuroborosCap8, AliceL991, j0hnwang, CryptoSources, jennyqcheng, 0xMaki, RyanKSterling, 0xChanglu, alexgedevani, NaytheForceBwU, jnwng, MariaShen, mattyryze, zacxbt, roybitsir, gregohr12, 0xbilly",22,https://x.com/i/user/1494856957471113219
1438586226341150721,Orange DAO 🍊 | founders wanted,Thu Sep 16 19:31:14 +0000 2021,"0xminion, rishisthinking, benlakoff, Mikey0x_, robbiepetersen_, amanda0x, geenty, j0hnwang, sjdedic, jennyqcheng, yekiM_o, samoyedali, 0xChanglu, alexgedevani, pokeapallascat, MariaShen, mattyryze, zacxbt, roybitsir, 0xbilly",20,https://x.com/i/user/1438586226341150721
1451982338779402244,OpenSea Pro,Sat Oct 23 18:42:29 +0000 2021,"0xminion, janehk, caseykcaruso, tkstanczak, j0hnwang, krybharat, ncerovac, jennyqcheng, Sh_ivam, 0xMaki, yekiM_o, 0xChanglu, MariaShen, mattyryze, roybitsir, GrantStenger, tomhschmidt, kapursanat, 0xbilly",19,https://x.com/i/user/1451982338779402244
1432446826519613446,Realms.World ☁️,Mon Aug 30 20:55:55 +0000 2021,"0xminion, andyisnotandy, BigBrainKasey, Louissongyz, tkstanczak, lmrankhan, j0hnwang, krybharat, jennyqcheng, Sh_ivam, 0xMaki, samoyedali, 0xChanglu, alexgedevani, MariaShen, mattyryze, zacxbt, roybitsir, gregohr12",19,https://x.com/i/user/1432446826519613446
1233275818983424000,Allora Labs,Fri Feb 28 06:20:51 +0000 2020,"0xminion, janehk, reganbozman, andyisnotandy, caseykcaruso, panekkkk, Shaughnessy119, lmrankhan, j0hnwang, sjdedic, Sh_ivam, 0xMaki, yekiM_o, samoyedali, MariaShen, mattyryze, zacxbt, AustinBarack, roybitsir",19,https://x.com/i/user/1233275818983424000
248459532,wilson.base.eth,Mon Feb 07 01:44:00 +0000 2011,"0xminion, Daryllautk, masonnystrom, amanda0x, geenty, j0hnwang, jonathankingvc, Sh_ivam, 0xMaki, HoolieG, caitlinxyz, gakonst, alexgedevani, MariaShen, roybitsir, gregohr12, delitzer, tomhschmidt, kapursanat",19,https://x.com/i/user/248459532
1433302892128133123,Treasure,Thu Sep 02 05:37:25 +0000 2021,"0xminion, sandraaleow, wkhosrowshahi1, andyisnotandy, pet3rpan_, OuroborosCap8, j0hnwang, krybharat, ncerovac, jennyqcheng, yekiM_o, samoyedali, 0xChanglu, Solofunk30, alexgedevani, MariaShen, mattyryze, zacxbt, AustinBarack, roybitsir, 0xbilly",21,https://x.com/i/user/1433302892128133123
177395566,XCOPY 🏴,Thu Aug 12 01:08:38 +0000 2010,"0xminion, janehk, benlakoff, pet3rpan_, panekkkk, AliceL991, j0hnwang, krybharat, 0xMaki, yekiM_o, 0xChanglu, Solofunk30, alexgedevani, MariaShen, mattyryze, AustinBarack, gregohr12, kapursanat, 0xbilly",19,https://x.com/i/user/177395566
1385312402795859968,Bubblemaps,Thu Apr 22 19:20:27 +0000 2021,"wkhosrowshahi1, YeouJie, Shaughnessy119, geenty, lmrankhan, j0hnwang, ncerovac, jennyqcheng, Sh_ivam, 0xMaki, 0xdetweiler, samoyedali, Solofunk30, alexgedevani, pokeapallascat, MariaShen, mattyryze, zacxbt, GrantStenger",19,https://x.com/i/user/1385312402795859968
