id,name,register_date,followed_by,followers_count,link
1855822374345789440,dev.fun,Mon Nov 11 04:08:40 +0000 2024,"serg_xyz, 0xminion, reganbozman, Shaughnessy119, firstc0in, j0hnwang, jonathankingvc, jennyqcheng, Sh_ivam, 0xMaki, 0xdetweiler, yekiM_o, samoyedali, alexgedevani, MariaShen, zacxbt, AustinBarack, roybitsir, gregohr12",19,https://x.com/i/user/1855822374345789440
125952671,Matt Shapiro,Wed Mar 24 11:22:41 +0000 2010,"serg_xyz, QwQiao, KyleSamani, OmniscientAsian, Darrenlautf, 0xminion, janehk, sandraaleow, masonnystrom, Mikey0x_, pet3rpan_, Shaughnessy119, geenty, jonathankingvc, Sh_ivam, 0xMaki, alexgedevani, mattyryze, AustinBarack",19,https://x.com/i/user/125952671
4889875948,charker 📱,Mon Feb 08 21:11:24 +0000 2016,"serg_xyz, KyleSamani, Darrenlautf, kidponga, sandraaleow, j0hnwang, jonathankingvc, 0xMaki, n4motto, caitlinxyz, alexgedevani, NaytheForceBwU, jnwng, thetinaverse, MariaShen, mattyryze, AustinBarack, roybitsir, GrantStenger",19,https://x.com/i/user/4889875948
285901606,Jay,Fri Apr 22 00:33:06 +0000 2011,"serg_xyz, Darrenlautf, 0xminion, janehk, reganbozman, wkhosrowshahi1, Shaughnessy119, lmrankhan, cooper_kunz, jonathankingvc, 0xMaki, HoolieG, samoyedali, caitlinxyz, alexgedevani, MariaShen, mattyryze, tomhschmidt, 0xbilly",19,https://x.com/i/user/285901606
519209521,Sid Coelho-Prabhu | sidcoin.eth 🛡️,Fri Mar 09 05:27:08 +0000 2012,"serg_xyz, QwQiao, NTmoney, OmniscientAsian, 0xminion, janehk, panekkkk, j0hnwang, ncerovac, AjeetK, jonathankingvc, 0xMaki, HoolieG, sjrosenblum, n4motto, jnwng, mattyryze, AustinBarack, roybitsir",19,https://x.com/i/user/519209521
1395628622417825795,Dariya Kho,Fri May 21 06:32:56 +0000 2021,"serg_xyz, QwQiao, 0xminion, janehk, reganbozman, benlakoff, pet3rpan_, bridge__harris, j0hnwang, jonathankingvc, Sh_ivam, 0xMaki, sjrosenblum, yekiM_o, n4motto, alexgedevani, MariaShen, roybitsir, GrantStenger",19,https://x.com/i/user/1395628622417825795
897890544613040128,Rocco,Wed Aug 16 18:39:22 +0000 2017,"serg_xyz, KyleSamani, Darrenlautf, 0xminion, janehk, reganbozman, masonnystrom, Mikey0x_, panekkkk, AliceL991, Shaughnessy119, geenty, n4motto, alexgedevani, MariaShen, mattyryze, roybitsir, delitzer, 0xbilly",19,https://x.com/i/user/897890544613040128
39592581,chrislyons,Tue May 12 20:50:50 +0000 2009,"serg_xyz, NTmoney, Darrenlautf, 0xminion, janehk, amanda0x, j0hnwang, sjdedic, jonathankingvc, HoolieG, sjrosenblum, yekiM_o, 0xChanglu, alexgedevani, MariaShen, mattyryze, AustinBarack, roybitsir, delitzer",19,https://x.com/i/user/39592581
1319287761048723458,Mario Nawfal,Thu Oct 22 14:42:25 +0000 2020,"serg_xyz, benlakoff, BigBrainKasey, eclecticcapital, OuroborosCap8, AliceL991, lmrankhan, j0hnwang, krybharat, AjeetK, sjdedic, jonathankingvc, 0xChanglu, Solofunk30, MariaShen, mattyryze, zacxbt, AustinBarack, 0xbilly",19,https://x.com/i/user/1319287761048723458
15875851,Dan Boneh,Sat Aug 16 19:23:31 +0000 2008,"0xRaghav, KyleSamani, rishisthinking, 0xRainandCoffee, benlakoff, SimaoCCruz, bridge__harris, panekkkk, tkstanczak, firstc0in, lmrankhan, notnotstorm, j0hnwang, _weidai, jonathankingvc, 0xMaki, HoolieG, mattyryze, GrantStenger",19,https://x.com/i/user/15875851
1237411,David Marcus,Thu Mar 15 18:09:53 +0000 2007,"0xRaghav, KyleSamani, janehk, SimaoCCruz, eclecticcapital, panekkkk, tkstanczak, Yedidbotton, lmrankhan, j0hnwang, Sh_ivam, HoolieG, sjrosenblum, NaytheForceBwU, MariaShen, mattyryze, zacxbt, AustinBarack, roybitsir",19,https://x.com/i/user/1237411
4727130589,Anurag Arjun,Fri Jan 08 06:29:39 +0000 2016,"0xRaghav, KyleSamani, 0xminion, kidponga, janehk, rishisthinking, 0xRainandCoffee, YeouJie, andyisnotandy, bridge__harris, Louissongyz, lmrankhan, j0hnwang, _weidai, Sh_ivam, 0xMaki, mattyryze, zacxbt, kapursanat",19,https://x.com/i/user/4727130589
1620182982240747520,Noble,Mon Jan 30 22:11:56 +0000 2023,"0xRaghav, 0xminion, janehk, 0xRainandCoffee, BigBrainKasey, eclecticcapital, j0hnwang, ncerovac, Sh_ivam, yekiM_o, ceterispar1bus, samoyedali, 0xChanglu, alexgedevani, mattyryze, zacxbt, AustinBarack, roybitsir, kapursanat",19,https://x.com/i/user/1620182982240747520
265758342,YQ,Mon Mar 14 03:09:10 +0000 2011,"0xRaghav, Darrenlautf, 0xWenMoon, 0xminion, ishanee_, reganbozman, YeouJie, bridge__harris, Louissongyz, tkstanczak, lmrankhan, j0hnwang, Sh_ivam, 0xMaki, 0xChanglu, mattyryze, zacxbt, AustinBarack, kapursanat",19,https://x.com/i/user/265758342
738803172991373312,Initialized Capital,Fri Jun 03 18:42:57 +0000 2016,"QwQiao, Darrenlautf, 0xminion, janehk, sandraaleow, YeouJie, panekkkk, lmrankhan, j0hnwang, krybharat, ncerovac, jonathankingvc, HoolieG, jnwng, MariaShen, mattyryze, AustinBarack, roybitsir, 0xbilly",19,https://x.com/i/user/738803172991373312
837985489,Damien (hmu for cracked Devs),Fri Sep 21 15:02:51 +0000 2012,"QwQiao, Darrenlautf, 0xminion, sandraaleow, andyisnotandy, OuroborosCap8, amanda0x, lmrankhan, j0hnwang, krybharat, sjdedic, 0xMaki, 0xdetweiler, 0xChanglu, Solofunk30, mattyryze, zacxbt, AustinBarack, roybitsir",19,https://x.com/i/user/837985489
831338680975384577,evgeny 毅夫,Tue Feb 14 03:06:01 +0000 2017,"QwQiao, Darrenlautf, kidponga, janehk, Mikey0x_, pet3rpan_, 0xKofi, panekkkk, robbiepetersen_, geenty, lmrankhan, j0hnwang, Sh_ivam, 0xMaki, sjrosenblum, mattyryze, AustinBarack, delitzer, 0xbilly",19,https://x.com/i/user/831338680975384577
1293904122605760513,BoringCrypto,Thu Aug 13 13:36:29 +0000 2020,"QwQiao, OmniscientAsian, Darrenlautf, 0xWenMoon, 0xminion, ishanee_, geenty, j0hnwang, krybharat, ncerovac, 0xMaki, ceterispar1bus, n4motto, alexgedevani, mattyryze, AustinBarack, roybitsir, kapursanat, 0xbilly",19,https://x.com/i/user/1293904122605760513
1126067837569617921,Casino Royale,Wed May 08 10:14:28 +0000 2019,"QwQiao, KyleSamani, Darrenlautf, 0xminion, janehk, reganbozman, Daryllautk, YeouJie, OuroborosCap8, panekkkk, lmrankhan, j0hnwang, ncerovac, 0xMaki, MariaShen, mattyryze, zacxbt, roybitsir, 0xbilly",19,https://x.com/i/user/1126067837569617921
1791798850644021248,Arfur Rock,Sat May 18 11:51:59 +0000 2024,"KyleSamani, stutireal, janehk, wkhosrowshahi1, pet3rpan_, 0xKofi, bridge__harris, Shaughnessy119, amanda0x, geenty, j0hnwang, op7418, HoolieG, caitlinxyz, alexgedevani, MariaShen, mattyryze, GrantStenger, kapursanat",19,https://x.com/i/user/1791798850644021248
3222018178,Brett Adcock,Wed Apr 29 17:26:26 +0000 2015,"KyleSamani, janehk, sandraaleow, cosmo_jiang, panekkkk, Shaughnessy119, tkstanczak, amanda0x, j0hnwang, op7418, krybharat, cooper_kunz, sjdedic, alexgedevani, mattyryze, zacxbt, gregohr12, GrantStenger, kapursanat",19,https://x.com/i/user/3222018178
866379494319378439,Cem | Sovereign,Sun May 21 19:45:42 +0000 2017,"KyleSamani, janehk, 0xRainandCoffee, masonnystrom, Louissongyz, eclecticcapital, panekkkk, Shaughnessy119, tkstanczak, j0hnwang, _weidai, Sh_ivam, 0xMaki, sjrosenblum, ceterispar1bus, n4motto, mattyryze, kapursanat, 0xbilly",19,https://x.com/i/user/866379494319378439
1493847997,Daren Matsuoka,Sat Jun 08 20:21:23 +0000 2013,"KyleSamani, Darrenlautf, 0xminion, janehk, Daryllautk, masonnystrom, caseykcaruso, panekkkk, geenty, notnotstorm, j0hnwang, krybharat, sjdedic, 0xMaki, sjrosenblum, MariaShen, mattyryze, zacxbt, GrantStenger",19,https://x.com/i/user/1493847997
1391254762499153922,Bullet,Sun May 09 04:57:23 +0000 2021,"KyleSamani, Darrenlautf, 0xminion, kidponga, janehk, robbiepetersen_, j0hnwang, Sh_ivam, 0xMaki, 0xdetweiler, ceterispar1bus, 0xChanglu, n4motto, NaytheForceBwU, thetinaverse, MariaShen, mattyryze, AustinBarack, GrantStenger",19,https://x.com/i/user/1391254762499153922
5731752,Wil Barnes,Thu May 03 05:23:31 +0000 2007,"KyleSamani, OmniscientAsian, Darrenlautf, 0xminion, janehk, sandraaleow, YeouJie, panekkkk, geenty, j0hnwang, 0xMaki, ceterispar1bus, n4motto, gakonst, MariaShen, mattyryze, AustinBarack, kapursanat, 0xbilly",19,https://x.com/i/user/5731752
1222368733227880448,0MOLLY WINTERMUT3,Wed Jan 29 04:00:23 +0000 2020,"KyleSamani, Darrenlautf, 0xWenMoon, 0xminion, reganbozman, Daryllautk, masonnystrom, OuroborosCap8, panekkkk, j0hnwang, 0xMaki, sjrosenblum, MariaShen, mattyryze, zacxbt, AustinBarack, delitzer, kapursanat, 0xbilly",19,https://x.com/i/user/1222368733227880448
976884195632001027,Fidelity Digital Assets,Thu Mar 22 18:11:56 +0000 2018,"KyleSamani, 0xminion, janehk, wkhosrowshahi1, benlakoff, panekkkk, geenty, lmrankhan, j0hnwang, jonathankingvc, Sh_ivam, ceterispar1bus, Solofunk30, NaytheForceBwU, MariaShen, mattyryze, AustinBarack, roybitsir, kapursanat",19,https://x.com/i/user/976884195632001027
927405023369224192,Richard Galvin,Mon Nov 06 05:19:22 +0000 2017,"KyleSamani, Darrenlautf, 0xminion, kidponga, YeouJie, SimaoCCruz, Shaughnessy119, tkstanczak, j0hnwang, krybharat, jennyqcheng, Sh_ivam, 0xMaki, ceterispar1bus, mattyryze, zacxbt, TaikiMaeda2, kapursanat, 0xbilly",19,https://x.com/i/user/927405023369224192
787018969,Ray Hindi,Tue Aug 28 13:29:39 +0000 2012,"KyleSamani, stutireal, Darrenlautf, kidponga, janehk, reganbozman, wkhosrowshahi1, YeouJie, pet3rpan_, panekkkk, Shaughnessy119, _weidai, sjdedic, jennyqcheng, Sh_ivam, alexgedevani, mattyryze, AustinBarack, kapursanat",19,https://x.com/i/user/787018969
985688130509393920,Binance Research,Mon Apr 16 01:15:38 +0000 2018,"KyleSamani, OmniscientAsian, Darrenlautf, 0xminion, janehk, Daryllautk, YeouJie, andyisnotandy, caseykcaruso, amanda0x, j0hnwang, CryptoSources, Sh_ivam, alexgedevani, mattyryze, zacxbt, AustinBarack, roybitsir, GrantStenger",19,https://x.com/i/user/985688130509393920
1034268067331694593,Alex Skidanov (alex.near),Tue Aug 28 02:34:57 +0000 2018,"KyleSamani, 0xminion, janehk, masonnystrom, benlakoff, OuroborosCap8, panekkkk, Shaughnessy119, lmrankhan, j0hnwang, _weidai, jonathankingvc, gakonst, MariaShen, mattyryze, roybitsir, delitzer, GrantStenger, 0xbilly",19,https://x.com/i/user/1034268067331694593
122235629,Ella Zhang,Fri Mar 12 01:58:20 +0000 2010,"KyleSamani, OmniscientAsian, 0xminion, janehk, rishisthinking, reganbozman, YeouJie, panekkkk, amanda0x, lmrankhan, j0hnwang, sjdedic, jennyqcheng, Sh_ivam, MariaShen, mattyryze, zacxbt, roybitsir, delitzer",19,https://x.com/i/user/122235629
2319408132,Marguerite,Thu Jan 30 19:22:59 +0000 2014,"KyleSamani, NTmoney, Darrenlautf, 0xminion, janehk, Daryllautk, masonnystrom, benlakoff, panekkkk, j0hnwang, krybharat, 0xChanglu, gakonst, alexgedevani, MariaShen, mattyryze, zacxbt, roybitsir, 0xbilly",19,https://x.com/i/user/2319408132
396135846,Chjango Unchained⛓️,Sat Oct 22 20:10:48 +0000 2011,"KyleSamani, NTmoney, Darrenlautf, janehk, Daryllautk, 0xRainandCoffee, wkhosrowshahi1, YeouJie, OuroborosCap8, lmrankhan, j0hnwang, yekiM_o, samoyedali, gakonst, alexgedevani, MariaShen, mattyryze, zacxbt, AustinBarack",19,https://x.com/i/user/396135846
923764031583789057,Set Labs ⚖️,Fri Oct 27 04:11:22 +0000 2017,"KyleSamani, OmniscientAsian, 0xminion, janehk, reganbozman, Daryllautk, panekkkk, geenty, lmrankhan, j0hnwang, ncerovac, 0xMaki, yekiM_o, MariaShen, mattyryze, AustinBarack, roybitsir, kapursanat, 0xbilly",19,https://x.com/i/user/923764031583789057
2178858974,Marco Santori,Wed Nov 06 21:53:38 +0000 2013,"KyleSamani, NTmoney, ishanee_, janehk, reganbozman, cosmo_jiang, panekkkk, Shaughnessy119, geenty, notnotstorm, j0hnwang, sjrosenblum, MariaShen, mattyryze, zacxbt, AustinBarack, roybitsir, delitzer, GrantStenger",19,https://x.com/i/user/2178858974
2631709828,notsofast,Sun Jun 22 15:45:53 +0000 2014,"KyleSamani, OmniscientAsian, Darrenlautf, 0xminion, janehk, 0xRainandCoffee, panekkkk, j0hnwang, krybharat, ncerovac, CryptoSources, 0xMaki, 0xdetweiler, ceterispar1bus, 0xChanglu, alexgedevani, MariaShen, mattyryze, zacxbt",19,https://x.com/i/user/2631709828
143053926,Gavin Andresen,Wed May 12 13:17:12 +0000 2010,"KyleSamani, NTmoney, OmniscientAsian, janehk, Daryllautk, benlakoff, SimaoCCruz, panekkkk, geenty, j0hnwang, 0xMaki, sjrosenblum, jnwng, MariaShen, mattyryze, zacxbt, AustinBarack, delitzer, GrantStenger, 0xbilly",20,https://x.com/i/user/143053926
1199812749469126657,bluesky,Wed Nov 27 22:10:52 +0000 2019,"OmniscientAsian, 0xminion, kidponga, janehk, reganbozman, wkhosrowshahi1, panekkkk, lmrankhan, krybharat, ncerovac, cooper_kunz, HoolieG, sjrosenblum, yekiM_o, thetinaverse, MariaShen, mattyryze, zacxbt, roybitsir",19,https://x.com/i/user/1199812749469126657
918804624303382528,PlanB,Fri Oct 13 11:44:27 +0000 2017,"OmniscientAsian, 0xWenMoon, 0xminion, janehk, YeouJie, benlakoff, SimaoCCruz, AliceL991, geenty, j0hnwang, sjdedic, Sh_ivam, 0xdetweiler, samoyedali, Solofunk30, MariaShen, mattyryze, zacxbt, 0xbilly",19,https://x.com/i/user/918804624303382528
1319408629,owen,Mon Apr 01 01:02:27 +0000 2013,"Darrenlautf, 0xminion, kidponga, Daryllautk, sandraaleow, wkhosrowshahi1, YeouJie, benlakoff, lmrankhan, j0hnwang, krybharat, ceterispar1bus, n4motto, Solofunk30, alexgedevani, mattyryze, zacxbt, AustinBarack, GrantStenger",19,https://x.com/i/user/1319408629
550381802,0xDQ.edge,Tue Apr 10 19:34:05 +0000 2012,"Darrenlautf, 0xWenMoon, 0xminion, 0xRainandCoffee, sandraaleow, benlakoff, SimaoCCruz, panekkkk, j0hnwang, jonathankingvc, 0xMaki, HoolieG, n4motto, alexgedevani, MariaShen, roybitsir, gregohr12, delitzer, kapursanat",19,https://x.com/i/user/550381802
1442893938508005378,New Order,Tue Sep 28 16:48:35 +0000 2021,"Darrenlautf, 0xminion, sandraaleow, benlakoff, j0hnwang, CryptoSources, Sh_ivam, 0xMaki, ceterispar1bus, samoyedali, n4motto, alexgedevani, MariaShen, mattyryze, zacxbt, AustinBarack, roybitsir, delitzer, kapursanat",19,https://x.com/i/user/1442893938508005378
1762571672207372289,Defi App 🎩,Tue Feb 27 20:13:48 +0000 2024,"0xWenMoon, kidponga, 0xRainandCoffee, robbiepetersen_, krybharat, CryptoSources, sjdedic, Sh_ivam, RyanKSterling, 0xdetweiler, yekiM_o, samoyedali, 0xChanglu, Solofunk30, NaytheForceBwU, mattyryze, zacxbt, roybitsir, 0xbilly",19,https://x.com/i/user/1762571672207372289
867328053416001536,CoinMetrics.io,Wed May 24 10:34:57 +0000 2017,"0xminion, kidponga, janehk, rishisthinking, Daryllautk, wkhosrowshahi1, YeouJie, panekkkk, AliceL991, geenty, j0hnwang, Sh_ivam, ceterispar1bus, alexgedevani, MariaShen, mattyryze, AustinBarack, roybitsir, kapursanat",19,https://x.com/i/user/867328053416001536
1365081137673076738,Quintus ⚡️🤖,Thu Feb 25 23:28:30 +0000 2021,"Daryllautk, 0xRainandCoffee, Mikey0x_, eclecticcapital, tkstanczak, j0hnwang, _weidai, ncerovac, cooper_kunz, ceterispar1bus, samoyedali, n4motto, caitlinxyz, gakonst, roybitsir, delitzer, GrantStenger, tomhschmidt, kapursanat",19,https://x.com/i/user/1365081137673076738
